	text	category	ln
2267	അത്ഭുതം!; ഗൗതം, നീ കൂടുതൽ ഉയരങ്ങളിൽ എത്തും.; സംഗീതം വളരെ മികച്ചതും മനോഹരവുമായിരുന്നു. ഇന്ന് മാരുതി സുസുക്കി അഡ്വ. ഒരു പുതിയ ലക്ഷ്യസ്ഥാനം; ഒരു പുതിയ അനുഭവം; നന്നായി, സെൻസിറ്റീവ് വിഷയം വിവേകത്തോടെ കൈകാര്യം ചെയ്തു.; നല്ലതുവരട്ടെ; സുബൈർ,	Non-anti-LGBT+ content	eng_ml
2268	യൂറോപ്യൻ സംസ്‌കാരത്തിലല്ല, ഇന്ത്യൻ ചരിത്ര കാലഘട്ടത്തിലാണ് ഇത് നിലനിൽക്കുന്നതെന്ന് ആളുകൾക്ക് മനസ്സിലാകുന്നില്ല.	Non-anti-LGBT+ content	eng_ml
2269	ഭാഗം 2 നായി കാത്തിരിക്കുന്നു	Non-anti-LGBT+ content	eng_ml
2270	ഇന്ത്യൻ സംസ്‌കാരത്തിൽ എൽജിബിടി ഇതിനകം നിലവിലുണ്ട്, പുരാണത്തിൽ പരാമർശിച്ചിട്ടുണ്ടെങ്കിലും കുട്ടികളെ ദുരുപയോഗം ചെയ്യുന്നുണ്ടോ? ഇന്ത്യൻ സംസ്കാരത്തിൽ ഉണ്ടായിരുന്നു	Non-anti-LGBT+ content	eng_ml
2271	ഇന്ത്യ ഒരു മൂന്നാം ക്ലാസ് രാജ്യമാണ്, ഈ മൂന്നാം ക്ലാസ് രാജ്യത്തെ ആളുകളുടെ ചിന്തകൾ മൂന്നാം ക്ലാസ് ആയിരിക്കും. ; ഇന്ത്യയിലെ LGBTQ കമ്മ്യൂണിറ്റിയോട് എനിക്ക് ഖേദമുണ്ട്, നിങ്ങൾ ജനിച്ചത് തെറ്റായ രാജ്യത്താണ്.	Non-anti-LGBT+ content	eng_ml
2272	സഹോദരങ്ങളെ സ്നേഹിക്കുന്നു	Non-anti-LGBT+ content	eng_ml
2273	സൂപ്പർ ഗേ കാമുകൻ കഥ	Non-anti-LGBT+ content	eng_ml
2274	ഇത് ശരിക്കും ഒരു ധൈര്യമാണ് ബ്രോ..പോകൂ..എന്റെ അഭിപ്രായത്തിൽ ഒരു വ്യക്തിക്ക് അവന്റെ/അവളുടെ സ്വന്തം രീതിയിൽ ജീവിക്കാൻ എല്ലാ അവകാശവും ഉണ്ട്..മറ്റൊന്നും ബാധിക്കാതെ..	Non-anti-LGBT+ content	eng_ml
2275	red_heart ഹൃദയത്തെ സ്പർശിക്കുന്ന മിന്നലുകൾ അപേക്ഷിക്കുന്ന_മുഖം ഉച്ചത്തിൽ_കരയുന്ന_മുഖം	Non-anti-LGBT+ content	eng_ml
2276	എനിക്ക് ലെസ്ബിയനിൽ താൽപ്പര്യമില്ല, പക്ഷേ ഞാൻ ഇതിനെ പിന്തുണയ്ക്കുന്നു	Non-anti-LGBT+ content	eng_ml
2277	റോയൽ ക്വീൻ  നിങ്ങൾ ഒരു സ്ത്രീയാണെന്നത് പോലെയല്ല.. കമന്റ് സെക്ഷനിലെ ഈ മോശം വാക്കുകൾ അവഗണിക്കുക, അവർ അത് നിങ്ങളുടെ മുഖത്തിന് മുന്നിലല്ല സോഷ്യൽ മീഡിയയിൽ മാത്രമേ പറയൂ.	Non-anti-LGBT+ content	eng_ml
2278	മാഷേ നിന്നെ ഓർത്ത് അഭിമാനിക്കുന്നു	Non-anti-LGBT+ content	eng_ml
2279	മരണം അപകടകരമായ ജീവിതം	Non-anti-LGBT+ content	eng_ml
2280	നിങ്ങളുടെ ടീമിനെ ഞാൻ അഭിനന്ദിക്കുന്നു	Non-anti-LGBT+ content	eng_ml
2281	സത്യത്തിൽ ഇതൊരു രോഗമാണ്....	Homophobic	eng_ml
2282	നിയമവിധേയമാക്കിയതുകൊണ്ട് അത് ശരിയാണെന്ന് അർത്ഥമാക്കുന്നില്ല	Non-anti-LGBT+ content	eng_ml
2283	0:54....ഇതുകാഗ സബ്‌സ്‌ക്രൈബ് പന്നിടാ.... പുഞ്ചിരിക്കുന്ന_മുഖം_ഹൃദയത്തോടെ നിങ്ങളുടെ മഹത്തായ പ്രവൃത്തികൾ തുടരുക.	Non-anti-LGBT+ content	eng_ml
2284	സൂപ്പർ ബ്രോ ഞാൻ അജയ് 19 ഞാൻ അവിവാഹിതനാണ് yaravathu true love person iruntha life long gay love irutha comment pannuga	Non-anti-LGBT+ content	eng_ml
2285	എല്ലാ രക്ഷിതാക്കളോടും ഞാൻ അഭ്യർത്ഥിച്ചു..പ്ലീസ് പ്ലീസ് .നിങ്ങളുടെ മകൻ സ്വവർഗ്ഗാനുരാഗിയാണെങ്കിൽ അവരെ മനസ്സിലാക്കാൻ ശ്രമിക്കൂ.അവനെ ഒഴിവാക്കരുത്, അടിക്കരുത്, ചിന്തിക്കരുത്..സമൂഹം മകനേ, അതവന്റെ പ്രശ്നമല്ല. ഹോർമോണുകളുടെ പ്രശ്‌നം.. അതിനാൽ ചിന്തിച്ച് അവരെ ഹൃദയപൂർവ്വം കൈകാര്യം ചെയ്യുക.അത് സ്വീകരിക്കുക..പ്ലീസ് ..	Non-anti-LGBT+ content	eng_ml
2286	Wy ttr അവരോട് പ്ലാറ്റ്ഫോം ടിക്കറ്റ് ചോദിക്കുന്നില്ലേ?	Non-anti-LGBT+ content	eng_ml
2287	ശരി_കൈ ഹൃദയത്തെ സ്പർശിക്കുന്ന ചുവന്ന_ഹൃദയ നിമിഷങ്ങൾ. Pakka ബോധവത്കരണ ഷോ thumbs_up . ഞാൻ പരമാവധി പങ്കിട്ടു. ശരിക്കും ഗംഭീരം. നല്ല ശ്രമം കൈകൊട്ടി_കൈകൾ. തുടരുക സുഹൃത്തുക്കളെ ഹാൻ‌ഡ്‌ഷേക്ക് .. ഭാഗത്തിനായി കാത്തിരിക്കുന്നു- 2 പുഞ്ചിരിക്കുന്ന_മുഖം_സൺഗ്ലാസുകളോടെ_എന്നെ_കൈ വിളിക്കുക	Non-anti-LGBT+ content	eng_ml
2288	ഞാൻ മനുഷ്യനാണ്  ആ വ്യക്തിക്ക് അവർ ആരായിരിക്കാൻ സൗകര്യമുണ്ടെങ്കിൽ, അതിനെ ചുറ്റിപ്പറ്റിയുള്ള വിലക്കുകൾ തകർക്കാൻ ശ്രമിക്കുന്നതിൽ എന്താണ് പ്രശ്നം. ഇത് ഒരു മത്സരമല്ല, അവൾ ട്രാൻസ് ആണോ അല്ലയോ എന്ന് കണ്ടെത്താൻ ശ്രമിക്കുന്നു.	Non-anti-LGBT+ content	eng_ml
2289	നിങ്ങൾക്ക് ധാരാളം കഴിവുകൾ ഉണ്ട് സഹോദരി നിങ്ങൾ കൂടുതൽ പഠിക്കുകയും സർക്കാർ ജോലി നേടുകയും ചെയ്യുന്നതിനേക്കാൾ ആളുകൾ നിങ്ങൾക്ക് കൂടുതൽ ബഹുമാനം നൽകും ഓം സായ് റാം.	Non-anti-LGBT+ content	eng_ml
2290	ഒരു സ്വവർഗ്ഗാനുരാഗിയാണ്, പക്ഷേ എന്റെ കുടുംബത്തെയും സമൂഹത്തെയും എങ്ങനെ നേരിടണമെന്ന് എനിക്കറിയില്ല ചെറുതായി_ചിരിക്കുന്ന_മുഖം സിപ്പർ-വായ മുഖം കലങ്ങിയ മുഖം ഉച്ചത്തിൽ_കരയുന്ന_മുഖം ചിന്താകുലമായ_മുഖം	Non-anti-LGBT+ content	eng_ml
2291	നിങ്ങളുടെ അച്ഛന്റെ പ്രതികരണവും പ്രതികരണവും എന്താണ് ???	Non-anti-LGBT+ content	eng_ml
2292	വിചിത്രനായ തമിഴൻ  ചില മാതാപിതാക്കൾ പക്വതയും ബുദ്ധിയും ഉള്ളവരാണ്.	Non-anti-LGBT+ content	eng_ml
2293	സിനിമ കൊള്ളാം... നല്ല ശ്രമം.... എന്തിനാണ് സെക്യൂരിറ്റിയുടെ സ്വകാര്യ ജീവിതത്തിൽ തന്റെ മകൻ സ്വവർഗ്ഗാനുരാഗിയാണോ അല്ലയോ എന്ന് ഊന്നിപ്പറയാൻ ശ്രമിക്കുന്നത്... അതിനാൽ ഇപ്പോൾ സെക്യൂരിറ്റിക്ക് തന്റെ മകൻ സ്‌ട്രെയ്‌റ്റാണെന്ന് അറിയാം, അതിനാൽ അവൻ വിശ്രമിക്കുന്നു... ഉടനടി വെട്ടിക്കളയുക, അർജുന് ക്ലോസറ്റിൽ ഇരിക്കുന്നതിൽ കുറ്റബോധം തോന്നുന്നുവെന്നും അവനെപ്പോലെ തന്നെ ജീവിതം നയിക്കാൻ സമ്മതിക്കുന്നുവെന്നും നിങ്ങൾ സ്ഥാപിക്കുന്നു... എന്നാൽ അവൻ ഇപ്പോൾ എന്താണ് അനുഭവിക്കുന്നതെന്നും എന്തിനാണ് പെട്ടെന്ന് ക്ലോസറ്റിൽ നിന്ന് പുറത്തുവരാൻ ഉദ്ദേശിക്കുന്നതെന്നും നിങ്ങൾ എവിടെയും ഊന്നിപ്പറഞ്ഞില്ല. .. ഈ സിനിമ സെക്യൂരിറ്റിയുടെ പോവിൽ നിന്നുള്ളതാണെന്ന് എന്നെ ചിന്തിപ്പിക്കുന്നു, സ്വവർഗാനുരാഗി ആയതിന് തന്റെ മകൻ അർജുനിനോട് സത്യസന്ധനും അനുകമ്പയുള്ളവനുമായതിൽ അദ്ദേഹം സന്തോഷിക്കുന്നു...അതിനാൽ അടിസ്ഥാനപരമായി നിങ്ങൾ സ്വവർഗ്ഗാനുരാഗികളായ പുരുഷന്മാരോ കൂടുതലും എൽജിബിടി അംഗങ്ങളോ വികലാംഗരെപ്പോലെയാണെന്ന് സ്ഥാപിക്കുന്നു. ...അതിനാൽ അവരോട് സഹതാപം തോന്നുന്നു	Homophobic	eng_ml
2294	പ്രീതി 2395 പ്രീതി ഞാൻ ലെസ്ബിയനാണ്	Non-anti-LGBT+ content	eng_ml
2295	മണി നിങ്ങൾക്ക് നല്ല ഭാവിയുണ്ട്, വലിയ സ്‌ക്രീൻ തുടരുക, വീഡിയോ ഗംഭീരമാണ്	Non-anti-LGBT+ content	eng_ml
2296	377 സെക്ഷൻ ശരിയാണ്, നല്ല ജോലി അഭിനന്ദനങ്ങൾ	Non-anti-LGBT+ content	eng_ml
2297	ശരണ്യ നിങ്ങൾക്ക് ഒരു കാര്യം ലഭിക്കുന്നില്ല. സമൂഹത്തിൽ സംവരണ സമ്പ്രദായം ഉള്ളിടത്തോളം ആരും ജാതി മറക്കില്ല. എല്ലായിടത്തും ആളുകൾ ആശുപത്രികൾ, വിദ്യാഭ്യാസം, സർക്കാർ ജോലികൾ എന്നിവയിൽ നിന്ന് ജാതി ചോദിക്കും, എല്ലാം ജാതിയുമായി ബന്ധപ്പെട്ടതാണ്, അവർക്ക് സംവരണ ആവശ്യങ്ങൾക്കായി ഈ ജാതി ആവശ്യമാണ്. സങ്കൽപ്പിക്കുക സംവരണ സങ്കൽപ്പമുണ്ടെങ്കിൽ, ആരെങ്കിലും അവരുടെ ജാതി പരാമർശിക്കേണ്ടത് എന്തുകൊണ്ട്? ഒരുപക്ഷെ 2 തലമുറകൾക്ക് ശേഷം, അവർ ഏത് ജാതിയിൽ പെട്ടവരാണെന്ന് പോലും ആരും ഓർക്കുന്നില്ല, കാരണം അവർ ഒരിക്കലും ജാതിയെ ഒരു ആവശ്യത്തിനും ഉപയോഗിക്കില്ല. അംബേദ്കർ പോലും പറഞ്ഞു, ഈ സംവരണ സങ്കൽപ്പം താൽക്കാലികമായിരിക്കണം, എന്നാൽ രാഷ്ട്രീയ ലക്ഷ്യങ്ങൾക്കായി ഇത് ഒരു പ്രധാന കാര്യമാണ്.	Non-anti-LGBT+ content	eng_ml
2298	സൗമ്യ നാരായൺ  അതെ അവൾ ലെസ്ബിയൻ ആണെങ്കിൽ...അമ്മക്ക് സന്തോഷമാണെങ്കിൽ ഞാനും സന്തോഷവാനാണ്...	Non-anti-LGBT+ content	eng_ml
2299	രണ്ട് പുരുഷ കഥാപാത്രങ്ങളുടെ പേരുകൾ അറിയാൻ ഞാൻ ആഗ്രഹിക്കുന്നു. അതിമനോഹരമായ അഭിനയം ലത്തീഫ്... ഹൃദയത്തിന് വികാരങ്ങൾ തോന്നി	Non-anti-LGBT+ content	eng_ml
2300	ഈ വീഡിയോ കണ്ടപ്പോൾ ഞാൻ ശരിക്കും കരഞ്ഞു, അവരെയും മനുഷ്യരെപ്പോലെ പരിഗണിക്കണം. ദൈവം അവരെ എല്ലാവരെയും അനുഗ്രഹിക്കട്ടെ! ശ്രീലങ്കയിൽ നിന്നുള്ള പ്രണയം red_heart red_heart face_blowing_a_kis face_blowing_a_kis	Non-anti-LGBT+ content	eng_ml
2301	അതെ എല്ലാം ശരിയാണ്	Non-anti-LGBT+ content	eng_ml
2302	അവൾ വളരെ യഥാർത്ഥ ട്രാൻസ്‌ജെൻഡറായ എല്ലാവരെയും അവൾ അനുഭവിച്ച വേദനയല്ല.. വളരെ കരുതലുള്ളവൾ.. നിങ്ങൾക്ക് ഹാറ്റ്സ് ഓഫ് അമ്മ..	Non-anti-LGBT+ content	eng_ml
2303	ആദ്യം, ലഘുചിത്രത്തിൽ നിന്ന്, ചിന്മയി തറയിൽ_ചിരിക്കുകയാണെന്ന് ഞാൻ കരുതി.	Non-anti-LGBT+ content	eng_ml
2304	സഹോദരി വളരെ സുന്ദരിയായ പുഞ്ചിരിക്കുന്ന_മുഖം_കണ്ണുനീർ നിറഞ്ഞ കണ്ണുകൾ ചുവന്ന ഹൃദയം	Non-anti-LGBT+ content	eng_ml
2305	Bro vera level satheyama suma sentiment tharumaru bro im waiting part 2 ദയവായി ഉടൻ വരൂ, എല്ലാവർക്കും എല്ലാവിധ ആശംസകളും_വിജയം_കൈവിജയം_കൈവിജയം_കൈ തീ തീ തീ തീ തീ തീ തീ തീ	Non-anti-LGBT+ content	eng_ml
2306	അത് സെക്ഷൻ 377 ആണ്	Non-anti-LGBT+ content	eng_ml
2307	അനീഷ് കൂൾ ഇതാണോ എന്റെ ചോദ്യം? നമ്മുടെ സംസ്‌കാരത്തെക്കുറിച്ച് ശരിക്കും അറിയാമെങ്കിൽ, ഇത് സംഭവിക്കുമോ? എന്തുകൊണ്ടാണ് നമ്മുടെ സംസ്കാരത്തിലെ നല്ല കാര്യങ്ങൾ നാം തിരിച്ചറിയാത്തത്? നിങ്ങൾ പോലും സോപ്പ് ഉപയോഗിക്കുന്നുണ്ടാകാം. Bt എന്റെ ജീവിതശൈലിയിൽ ഞാൻ കൂടുതലും ഹെർബലുകൾ ഉപയോഗിക്കുന്നു. ഞാൻ പാശ്ചാത്യ ജീവിതരീതിയെ പിന്തുണയ്ക്കുന്നുവെന്ന് കരുതരുത്. ഞാൻ കാലഹരണപ്പെട്ട മാനദണ്ഡങ്ങൾക്ക് എതിരാണ്. നിങ്ങളുടെ ജീവിതശൈലിയിൽ സംസ്കാരം കൊണ്ടുവരിക. പരമ്പരാഗത ജീവിതം നയിക്കുക, ആധുനിക ചിന്തകളെ അടിച്ചമർത്തരുത്. യോഗ ഇന്ത്യയിൽ നിന്നുള്ളതാണെന്ന് ലോകം മുഴുവൻ അറിയുന്നു. അവർ അത് ഉപയോഗിച്ചാലും ഉപയോഗിക്കട്ടെ. അപ്പോൾ ലോകം കൂടുതൽ ശാന്തമാകും. അതെ, ഇത് ബിസിനസ്സായി മാറിയിരിക്കുന്നു, ഞാൻ സമ്മതിക്കുന്നു. നമ്മൾ അത് നിയന്ത്രിക്കണം.	Non-anti-LGBT+ content	eng_ml
2308	hmmmm സ്നേഹമാണ് ആളുകൾ പാപങ്ങൾ ചെയ്യുന്ന ഏറ്റവും ശക്തമായ ആയുധം :)	Non-anti-LGBT+ content	eng_ml
2309	കൊള്ളാം ... ഞാൻ എന്റെ വിവാഹത്തിനായി കാത്തിരിക്കുകയാണ്... പക്ഷെ പങ്കാളിയോ ?	Non-anti-LGBT+ content	eng_ml
2310	അവൾ വളരെ സുന്ദരിയും മനോഹരവുമാണ്	Non-anti-LGBT+ content	eng_ml
2311	അവൾ വളരെ സുന്ദരിയായി കാണപ്പെടുന്നു	Non-anti-LGBT+ content	eng_ml
2312	നല്ല വാക്കുകൾ മാലിനി	Non-anti-LGBT+ content	eng_ml
2313	ഇന്ത്യയിൽ ഹെമോസെക്‌സ് വിവാഹവും ലെസ്ബിയൻ വിവാഹവും ദൈവം ശിക്ഷിക്കും, എന്താണ് ഇന്ത്യക്ക് സംഭവിക്കാൻ പോകുന്നത്	Homophobic	eng_ml
2314	അമ്മയുടെ സ്നേഹമാണ് ജീവിതത്തിൽ ഏറ്റവും പ്രധാനം	Non-anti-LGBT+ content	eng_ml
2315	ശരിയാണ് ആഹ് സോന്നിങ്ങാ....	Non-anti-LGBT+ content	eng_ml
2316	സയ്യിദ് അലി ഷെയ്ക്ക് wt hpn പ്രിയപ്പെട്ട ഊർ വാട്ട്‌സ്ആപ്പ് നമ്പർ	Non-anti-LGBT+ content	eng_ml
2317	അവരെ സ്വതന്ത്രരാക്കട്ടെ. അവരുടെ മേൽ നിങ്ങളുടെ സംസ്കാരവും ധാർമികതയും അടിച്ചേൽപ്പിക്കരുത്. ലോകത്ത് 700000000 ജനങ്ങളും ഇന്ത്യയിൽ 120 കോടിയിലധികം ആളുകളുമുണ്ട്. LGBTQ 1 ശതമാനത്തിൽ കൂടരുത്. അതിനാൽ എന്റെ പ്രിയപ്പെട്ട പരമ്പരാഗത ജനങ്ങളേ, ഇത് മനുഷ്യരാശിയുടെ അവസാനമാകില്ല. ഒരു കുട്ടി ജനിക്കുക എന്നത് മാത്രമല്ല മനുഷ്യജീവിതത്തിന്റെ ലക്ഷ്യം. കുട്ടികളില്ലാതെ പോലും സ്നേഹമുള്ള, കരുതലുള്ള നിരവധി ദമ്പതികളെ ഞാൻ കണ്ടിട്ടുണ്ട്. പുനരുൽപ്പാദനം മാത്രമല്ല, എല്ലാം സ്നേഹമാണ്	Non-anti-LGBT+ content	eng_ml
2318	സെമ്മ അഭിനയം ബ്രോ മുഖം_കണ്ണുനീർ_ഓഫ്_ആനന്ദം ... നല്ല സാമൂഹിക ആശയം കൂടി.... സമൂഹത്തിന് നല്ല അവബോധം നൽകുന്നു.	Non-anti-LGBT+ content	eng_ml
2319	അക്കാ നീ ഈ ലോകത്തിലെ വളരെ അനുഗ്രഹീതയായ പെൺകുട്ടി	Non-anti-LGBT+ content	eng_ml
2320	സമയനഷ്ടം	Non-anti-LGBT+ content	eng_ml
2321	സ്വവർഗരതി പരിണാമത്തിന്റെ ഒരു രൂപം മാത്രമാണെന്നാണ് എനിക്ക് തോന്നുന്നത്. ആദ്യകാലങ്ങളിൽ പോഷകാഹാരക്കുറവ് കാരണം അമിതഭാരമുള്ളവരിലേക്ക് ആളുകൾ ആകർഷിക്കപ്പെട്ടു. അമിത വണ്ണം കാരണം ഇപ്പോൾ നേരെ തിരിച്ചാണ്. അതുപോലെ തന്നെ ജനസംഖ്യാ വർദ്ധനവ് കാരണം ഒരേ ലിംഗത്തിലുള്ളവരോട് കുറച്ച് ആളുകൾ ലൈംഗികമായി ആകർഷിക്കപ്പെടുന്നു.	Non-anti-LGBT+ content	eng_ml
2322	നല്ല ശ്രമം ടീം.	Non-anti-LGBT+ content	eng_ml
2323	അവൾ വളരെ സുന്ദരിയാണ്	Non-anti-LGBT+ content	eng_ml
2324	തേരു നങ്ങൈ മോശമല്ല അവൾ നല്ലവളാണ്...	Non-anti-LGBT+ content	eng_ml
2325	സ്നേഹം സ്നേഹമാണ്, അതിനാൽ എന്താണ് സ്വവർഗ്ഗാനുരാഗി!	Non-anti-LGBT+ content	eng_ml
2326	എന്റെ കാഴ്ചപ്പാടുകളിലൂടെ കടന്നുപോകാൻ നിങ്ങളുടെ വിലപ്പെട്ട സമയം ചെലവഴിച്ചതിന് വളരെ നന്ദി. സത്യസന്ധമായി പറഞ്ഞാൽ, ആരുടെയും പ്രവൃത്തിയെക്കുറിച്ച് അഭിപ്രായം പറയാൻ ഞാൻ ഒരു തരത്തിലും തികഞ്ഞവനല്ല; പക്ഷെ ഇത് എനിക്ക് ചുറ്റും കണ്ടതിൽ നിന്നുള്ള എന്റെ ചിന്തകൾ മാത്രമാണ്. എല്ലാത്തിനും ഒരു സമയമുണ്ട് എന്ന ഈ വസ്തുതയിൽ ഞാൻ വിശ്വസിക്കുന്നു. തെറ്റുകൾ ചെയ്യാനുള്ള സമയവും ചെയ്ത തെറ്റുകൾ തിരിച്ചറിയാനും പശ്ചാത്തപിക്കാനും ഉള്ള സമയം. ഈ വിലയേറിയ ആത്മാക്കൾ ഒരുനാൾ തങ്ങളുടെ കുറവുകൾ തിരിച്ചറിയട്ടെ എന്ന് ഞാൻ ആത്മാർത്ഥമായി ആഗ്രഹിക്കുന്നു, പ്രതീക്ഷിക്കുന്നു.; വീണ്ടും നന്ദി!	Homophobic	eng_ml
2327	നിങ്ങളുടെ സ്വഭാവത്തിന് ഞാൻ നിന്നെ സ്നേഹിക്കുന്നു	Non-anti-LGBT+ content	eng_ml
2328	LGBT നമ്മുടെ ഇന്ത്യയെ സ്വാഗതം ചെയ്യുന്നു	Non-anti-LGBT+ content	eng_ml
2329	സ്നേഹിച്ചു കരഞ്ഞു. തൊടാതെ കണ്ണുകൊണ്ട് അത്രയും തീവ്രമായ പ്രണയം. ലത്തീഫ് കഥാപാത്രം വളരെ മധുരവും തീവ്രവുമാണ്.	Non-anti-LGBT+ content	eng_ml
2330	മുത്തുകുമാർ പി ഹായ് ഫ്രണ്ട് സെമ്മ സിനിമ	Non-anti-LGBT+ content	eng_ml
2331	ഹേയ് ഗൗരവമായി ഞാൻ കരുതി അവൾ ഒരു ട്രാൻസ്‌ജെൻഡർ ആണെന്ന്	Transphobic	eng_ml
2332	10 വർഷത്തെ മൊത്തം ലോകജനത എച്ച്ഐവി രോഗികൾ (കുട്ടികളില്ല).100% പൊരുത്തപ്പെടുന്നു.	Homophobic	eng_ml
2333	അവൾ വളരെ നല്ല സഹോദരി	Non-anti-LGBT+ content	eng_ml
2334	ബ്രോ ഇന്റർകാസ്റ്റ് വിവാഹത്തെ കുറിച്ച് സംസാരിക്കുക	Non-anti-LGBT+ content	eng_ml
2335	അവിടെ ഉറങ്ങുന്നു	Non-anti-LGBT+ content	eng_ml
