	text	category	ln
1547	ചൊവ്വയെക്കുറിച്ചുള്ള വൺവേ യാത്രയെക്കുറിച്ച് ഒരു വീഡിയോ ഉണ്ടാക്കുക	Non-anti-LGBT+ content	eng_ml
1548	ഗംഭീരം സാർ - കണ്ണുനീർ നിറഞ്ഞ_മുഖം	Non-anti-LGBT+ content	eng_ml
1549	ഹാറ്റ്സ് ഓഫ് യുവാക്കളുടെ..	Non-anti-LGBT+ content	eng_ml
1550	ആൺകുട്ടികൾ പെൺകുട്ടികളെ ബലാത്സംഗം ചെയ്താൽ ഏത് പെൺകുട്ടിയാണ് ആൺകുട്ടിയെ വിശ്വസിക്കുക	Non-anti-LGBT+ content	eng_ml
1551	ഈ ആളുകൾ ജീവിക്കുന്നത് വളരെ വേദനയിലാണ്, നമ്മുടെ ആളുകൾ എല്ലാവരേയും ബഹുമാനിക്കാൻ തുടങ്ങണം, അവൾ വളരെ ദയയുള്ളവളാണ്..... ലവ് യു സഹോദരി	Non-anti-LGBT+ content	eng_ml
1552	നിങ്ങളുടെ വീഡിയോ കണ്ടതിന് ശേഷം എനിക്ക് ഇത് വളരെ വ്യക്തമായി അറിയാം ബ്രോ സൂപ്പർ കീപ്പ്	Non-anti-LGBT+ content	eng_ml
1553	Gowtham G  LGBT PPL നിലവിൽ ഇന്ത്യയിലെ മൊത്തം ജനസംഖ്യയുടെ 1/4-ൽ കൂടുതലാണ്.	Non-anti-LGBT+ content	eng_ml
1554	ഇത് കാണാൻ യോഗ്യമാണ് red_heart	Non-anti-LGBT+ content	eng_ml
1555	എപ്പ എന്നാ ബിൽഡ് അപ്പ്.. ഈ വീഡിയോ കാണുന്നവർ ഭാവിയിൽ നിങ്ങളോട് ഒരിക്കലും പ്രൊപ്പോസ് ചെയ്യില്ല, ഗ്രേ ടീ ഷർട്ട്..	Non-anti-LGBT+ content	eng_ml
1556	അത് അപ്‌ലോഡ് ചെയ്തതിന് നന്ദി	Non-anti-LGBT+ content	eng_ml
1557	അവൾ തികച്ചും സ്ത്രീയായി കാണപ്പെടുന്നു. ശബ്ദം മാത്രം അസ്വസ്ഥമാണ്.	Non-anti-LGBT+ content	eng_ml
1558	തിരുവള്ളുവരെയും 18 സിദ്ധർമാരെയും കുറിച്ച് വീഡിയോ ചെയ്യൂ ബ്രോ	Non-anti-LGBT+ content	eng_ml
1559	ഈ ആളുകളെ ബഹുമാനിക്കുക.. അവൾ വളരെ സുന്ദരിയാണ്	Non-anti-LGBT+ content	eng_ml
1560	മദൻ ഗൗരി ഔമുവാമുവ #നക്ഷത്രാന്തര വസ്തു	Non-anti-LGBT+ content	eng_ml
1561	അഭിനയം അത്താഴം ബ്രോ	Non-anti-LGBT+ content	eng_ml
1562	സ്നേഹം സ്നേഹമാണെന്ന് ഞാൻ അംഗീകരിക്കുന്നു	Non-anti-LGBT+ content	eng_ml
1563	വിഷമിക്കരുത് സഹോദരി... ധൈര്യമായിരിക്കുക...ഞാൻ നേരായ മനുഷ്യനാണ് പക്ഷെ ഞാൻ ഇതിനെ പിന്തുണയ്ക്കുന്നു...ഇതും ദൈവം മനുഷ്യരിൽ ഉണ്ടാക്കിയ മാറ്റമാണ്...ppl അത് മനസ്സിലാക്കില്ല...കാരണം മിക്കവരും പക്വതയും ശരിയായ ചിന്താഗതിയുമില്ലാത്ത വിദ്യാഭ്യാസമില്ലാത്ത അല്ലെങ്കിൽ വിദ്യാസമ്പന്നരായ വിഡ്ഢികളാണ് ഇവിടെ...	Non-anti-LGBT+ content	eng_ml
1564	ദൈവം നിന്നെ അനുഗ്രഹിക്കട്ടെ	Non-anti-LGBT+ content	eng_ml
1565	ഞാനിപ്പോൾ ഒരു ഫീച്ചർ ഫിലിം ചെയ്തു കഴിഞ്ഞു	Non-anti-LGBT+ content	eng_ml
1566	ഞാൻ LGBT ആണ്.. എനിക്ക് എന്റെ ജീവിതം പങ്കിടണം.. pls subscribe my channel	Non-anti-LGBT+ content	eng_ml
1567	അവർ LGBTയെ പിന്തുണയ്ക്കുന്നില്ല. സ്ത്രീയുടെ ഭാവി നശിപ്പിക്കാൻ അവർ ബലാത്സംഗത്തെ പിന്തുണയ്ക്കുന്നു	Non-anti-LGBT+ content	eng_ml
1568	അക്കാ നീ ശരിക്കും മഹാനാണ്...	Non-anti-LGBT+ content	eng_ml
1569	എന്തിന്.. അവൾ പറയുന്നത് എന്താണ് തെറ്റ്.. അവർ ജനിച്ചത് തത്തയെ പോലെയാണ്.. അവർക്ക് അവരുടേതായ അവകാശങ്ങളുണ്ട്.. നിങ്ങൾക്ക് ശാസ്ത്രം അറിയില്ലെങ്കിൽ പിന്നെ വിവേചനം കാണിക്കരുത്.	Non-anti-LGBT+ content	eng_ml
1570	ഈ സിനിമ എന്റെ കുടുംബാംഗങ്ങളെ കാണിക്കാൻ ഞാൻ ആഗ്രഹിക്കുന്നു. ഇത് ഒരു അത്ഭുതകരമായ കഥയാണ്, വളരെ ആപേക്ഷികവുമാണ്.	Non-anti-LGBT+ content	eng_ml
1571	ഞാൻ ഹോമോ അല്ല ബ്രോ	Non-anti-LGBT+ content	eng_ml
1572	ഞാൻ അവളെ ചികിത്സിക്കുമെന്ന് എനിക്ക് തോന്നുന്നു. കാരണം അവൾ ട്രാൻസ്‌ജെൻഡറാണ്. നിങ്ങൾ അവളെ പാപ്പാ നു എന്നാണ് വിളിക്കുന്നത്. അവൾ ഒരു പെൺകുട്ടിയാകാൻ ആഗ്രഹിക്കുന്നു. നിങ്ങൾ മറ്റുള്ളവരോട് സംസാരിക്കുമ്പോൾ നിങ്ങളുടെ പെരുമാറ്റം വ്യത്യസ്തമാണ്. അത് മാറ്റൂ.	Non-anti-LGBT+ content	eng_ml
1573	1.3 കെ ലൈക്ക് ചെയ്യുന്നു, എന്നാൽ 1.4 കെ കമാൻഡ് ചെയ്യുന്നു	Non-anti-LGBT+ content	eng_ml
1574	എന്നാൽ ആ ട്രാൻസ്‌ജെൻഡർ അവനുവേണ്ടി നൃത്തം ചെയ്യുന്നത് ഹൃദയഭേദകമായ ഉറക്കത്തിന്റെ മുഖമാണ്	Non-anti-LGBT+ content	eng_ml
1575	ജോയൽ ബോൺകെ. ഇവിടെ ആരും ബൈബിൾ ജീവിതം നയിക്കുന്നില്ല ബ്രോ.. എല്ലാത്തിലും മതം കൊണ്ടുവരുന്നത് നിർത്തൂ.. വളരൂ.	Non-anti-LGBT+ content	eng_ml
1576	കാർത്തിക് കുടുംബം വരുണിനെ എങ്ങനെ പരിപാലിക്കുന്നുവെന്ന് എനിക്ക് ഇഷ്ടമാണ്.	Non-anti-LGBT+ content	eng_ml
1577	സൂപ്പർ ചേച്ചി. നിങ്ങൾ അവർക്ക് ജോലി നൽകുന്നുണ്ടോ?	Non-anti-LGBT+ content	eng_ml
1578	വളരെ കൊള്ളാം, നിങ്ങളുടെ കൈകൾ നല്ല മടക്കിയതായിരിക്കും	Non-anti-LGBT+ content	eng_ml
1579	വിചിത്രമായ കണക്ക് ഓം ഉർ വളരെ ധീരനും ശക്തനുമായ വ്യക്തി	Non-anti-LGBT+ content	eng_ml
1580	റെയിൽവേ പോലീസ് എപ്പോഴും ഉറങ്ങുകയാണ്, ആർപിഎഫ് ഏറ്റവും മോശം പോലീസ് ഡിപ്പാർട്ട്‌മെന്റാണ്. തന്ത്രപരമായ കാര്യങ്ങൾ എങ്ങനെ നിയന്ത്രിക്കാമെന്ന് അവർ നമ്മുടെ ടിഎൻ പോലീസിൽ നിന്ന് പഠിക്കണം.	Non-anti-LGBT+ content	eng_ml
1581	ബ്രോ പ്ലീസ് മനസ്സിൽ കള ഗാനം മെഡിറ്റേഷൻ ചെയ്യൂ plz വിശദീകരിക്കുക	Non-anti-LGBT+ content	eng_ml
1582	മാത്തൻ എസ് അതെ പ്രിയ യേശു, മാത്തൻ എന്നോടും കുറച്ച് കരുണ കാണിക്കൂ	Non-anti-LGBT+ content	eng_ml
1583	മഹാഭാരത കാലത്തും LGBT ഉണ്ടായിരുന്നു... വെള്ളക്കാരും ബ്രാഹ്മണരും ബ്രെയിൻ വാഷ് ചെയ്യരുത്	Non-anti-LGBT+ content	eng_ml
1584	ആന്റണി രാജരത്നം  അത് തെളിയിക്കപ്പെട്ടിട്ടില്ല, ഇപ്പോഴും ഗവേഷണത്തിലാണ്.. അത് തെളിയിക്കപ്പെട്ടതായി വ്യക്തമാക്കുന്ന ചില പുസ്തകങ്ങൾ ദയവായി എന്നെ പരിശോധിക്കുക.	Non-anti-LGBT+ content	eng_ml
1585	സൂപ്പർ	Non-anti-LGBT+ content	eng_ml
1586	മികച്ച വ്യക്തമായ വിശദീകരണം എന്തായാലും	Non-anti-LGBT+ content	eng_ml
1587	ഞാനും കാത്തിരിക്കുന്നു അന്ന പുഞ്ചിരിക്കുന്ന_മുഖം_തുറന്ന_കൈകളോടെ പുഞ്ചിരിക്കുന്ന_മുഖം_തുറന്ന_കൈകളോടെ പുഞ്ചിരിക്കുന്ന_മുഖം പുഞ്ചിരിക്കുന്ന_മുഖം	Non-anti-LGBT+ content	eng_ml
1588	ഇക്കാലത്ത് സ്വവർഗ്ഗാനുരാഗം സത്യമല്ല, കാരണം എല്ലാ വ്യക്തികളും ലൈംഗികതയ്ക്കായി മാത്രം പരിഗണിക്കുന്നു.	Homophobic	eng_ml
1589	വിവാഹം കഴിക്കാൻ യോഗ്യരായ ട്രാൻസ്‌ജെൻഡർമാരെ മാത്രമേ ഞാൻ പിന്തുണയ്ക്കൂ	Non-anti-LGBT+ content	eng_ml
1590	ബ്രോ ദയവായി റെഡ് ഇന്ത്യക്കാരെ കുറിച്ച് പറയൂ	Non-anti-LGBT+ content	eng_ml
1591	നമ്മുടെ സമൂഹം കുറച്ചു കാലം വളരെ മോശമാണ്	Non-anti-LGBT+ content	eng_ml
1592	ലത്തീഫ് ഹരീഷിനെ 'ഡാർലിംഗ്' എന്ന് വിളിച്ചപ്പോൾ ഹൂ സ്വീറ്റ് ഉറക്കെ_കരയുന്ന_മുഖം & ഹരീഷ് 'ഐ ലവ് യു' എന്ന് വിളിച്ചപ്പോൾ രണ്ട് നിമിഷങ്ങളും എനിക്ക് വളരെ മധുരമായിരുന്നു.. എനിക്ക് ഒരു ചെറിയ പുഞ്ചിരി തരൂ.....എനിക്കും അവനെപ്പോലെ ഒരു പങ്കാളിയെ ലഭിക്കണം red_heart	Non-anti-LGBT+ content	eng_ml
1593	ഗംഭീരം ബ്രോ സൺഗ്ലാസ്സോടെ_ചിരിക്കുന്ന_മുഖം	Non-anti-LGBT+ content	eng_ml
1594	ജീ വാ യു വാട്ട്‌സ്ആപ്പ് നമ്പർ എനിക്ക് അയക്കുക	Non-anti-LGBT+ content	eng_ml
1595	രാജകീയ രാജ്ഞി  അറിവ് മോഷ്ടിക്കുന്നത് ഒരു വസ്തു മോഷ്ടിക്കുന്നതിനേക്കാൾ കുറ്റകരമാണ്. ഇന്ത്യക്കാർ പാശ്ചാത്യ ശൈലി പകർത്തുന്നില്ല, പാശ്ചാത്യ സംസ്കാരം പിന്തുടരാൻ അവരെ സ്വാധീനിക്കുന്നു. സംസ്കാരം വിൽക്കുന്നു.. ഈ പാശ്ചാത്യ സംസ്കാരം മനുഷ്യർക്ക് നല്ലതല്ല. നമ്മുടെ ഇന്ത്യൻ സംസ്കാരത്തിന് കൂടുതൽ മൂല്യങ്ങളുണ്ട്. മനുഷ്യർ..സ്വാധീനത്താൽ സമൂഹം മാറിയിരിക്കുന്നു.4 പെൺകുട്ടികൾ ഒരാളെ കുറിച്ച് മോശമായി സംസാരിക്കുന്ന ഒരു വീഡിയോ നിങ്ങൾ കണ്ടിട്ടുണ്ടോ??..നിങ്ങൾ വെറും ഫെമിനിസം തരംഗ 3ൽ ആണ് അല്ലെ?? .തരംഗത്തിൽ 4,5 പെൺകുട്ടികൾ ആൺകുട്ടികളേക്കാൾ അഹങ്കാരികളായിരിക്കും.അടിസ്ഥാനപരമായി ഫെമിനിസ്റ്റുകൾ പുരുഷന്മാരെക്കാൾ മുകളിലായിരിക്കാൻ ആഗ്രഹിക്കുന്നു.	Non-anti-LGBT+ content	eng_ml
1596	ഗിരുഭാകറിന് കൂടുതൽ യോജിക്കാൻ കഴിഞ്ഞില്ല. പുരുഷന്മാർ പോലും അടിമകളാണ് bt സ്ത്രീകളേക്കാൾ അല്പം ഉയർന്നതാണ്. എന്നാൽ പുരുഷന്മാർ അത് തിരിച്ചറിയുന്നില്ല.	Non-anti-LGBT+ content	eng_ml
1597	ഗംഭീര സിനിമ, എന്ത് സംഭവിച്ചാലും പ്രണയത്തിന് അതിരുകളില്ല	Non-anti-LGBT+ content	eng_ml
1598	thirungay great vedio-നോടുള്ള ആദരവ്	Non-anti-LGBT+ content	eng_ml
1599	ഐശ്വര്യ രാംദാസ്  പിന്തുണയ്ക്ക് നന്ദി	Non-anti-LGBT+ content	eng_ml
1600	അവൾ വളരെ സുന്ദരിയാണ്, ഭാവിയിൽ ഒരു നായികയായേക്കാം, വളരെ സുന്ദരിയാണ്	Non-anti-LGBT+ content	eng_ml
1601	അടുത്ത വീഡിയോയ്‌ക്കായി കാത്തിരിക്കുന്നു പ്രിയേ_ഒരു_ചുംബനം_തുറന്ന_കൈകളോടെ_ചിരിക്കുന്ന_മുഖം	Non-anti-LGBT+ content	eng_ml
1602	ഹൃദയസ്പർശിയായ red_heart red_heart red_heart വീഡിയോ	Non-anti-LGBT+ content	eng_ml
1603	തകർപ്പൻ പ്രസംഗം. വളരെ തുറന്ന മനസ്സോടെ സംസാരിച്ചു.	Non-anti-LGBT+ content	eng_ml
1604	Pathivukku nandri.. ഈ സഹോദരിയെ കുറിച്ചുള്ള വികാരം...	Non-anti-LGBT+ content	eng_ml
1605	പിന്നെ എന്റെ മുഖം കാണണ്ട.... കണ്ണടക്കൂ. അതുപോലെ നിങ്ങളുടെ മസ്തിഷ്കം ഒരു അടഞ്ഞ പെട്ടിയിലാക്കി.... തറയിൽ_ചിരിക്കുന്നു	Non-anti-LGBT+ content	eng_ml
1606	സഞ്ജീവ് എ ഇതാണ് പ്രശ്നം, എന്തുകൊണ്ടാണ് ഈ ലൈംഗികതയുടെ പോയിന്റ് കാണേണ്ടത്. അതിരുകൾക്കപ്പുറമുള്ള ബന്ധമായി ഇതിനെ കാണുക.	Non-anti-LGBT+ content	eng_ml
1607	അവൾ ഒരു ഡോക്യുമെന്ററി എഴുത്തുകാരിയും ചലച്ചിത്ര നിർമ്മാതാവും LGBTQ അനുഭാവിയുമാണ്... വളരെ ധൈര്യമുള്ള പെൺകുട്ടി	Non-anti-LGBT+ content	eng_ml
1608	loudly_crying_face ഉറക്കെ കരയുന്ന മുഖം കരയുന്ന മുഖം ശരിക്കും ഈ ഷോർട്ട് ഫിലിം എന്നെ വേദനിപ്പിച്ചു	Non-anti-LGBT+ content	eng_ml
1609	സമയനഷ്ടം	Non-anti-LGBT+ content	eng_ml
1610	യൂറോപ്യൻ സംസ്‌കാരത്തിലല്ല, ഇന്ത്യൻ ചരിത്ര കാലഘട്ടത്തിലാണ് ഇത് നിലനിൽക്കുന്നതെന്ന് ആളുകൾക്ക് മനസ്സിലാകുന്നില്ല.	Non-anti-LGBT+ content	eng_ml
1611	അതെ സുഹൃത്തേ, അവർ മറ്റുള്ളവരെപ്പോലെ ഒന്നും പ്രതീക്ഷിക്കുന്നില്ല. സ്വീകാര്യത മാത്രം മതി.	Non-anti-LGBT+ content	eng_ml
1612	അല്ല, ഇത് മറ്റ് ട്രാൻസ് ആളുകളുടെ ജീവിതത്തെ മാറ്റിമറിച്ചേക്കാം. ഇത് കണ്ടതിന് ശേഷം അവർക്ക് ഒരു മടിയും കൂടാതെ ജീവിതം നയിക്കാൻ കഴിയും.	Non-anti-LGBT+ content	eng_ml
1613	ഇത്തരം സിനിമകളെ സപ്പോർട്ട് ചെയ്യുക!! ഇതിനെക്കുറിച്ച് എല്ലായിടത്തും എഴുതുക, ഗൂഗിളിൽ അവലോകനം ചേർക്കുക, ലോകമെമ്പാടുമുള്ള മുഴുവൻ തമിഴ് പ്രേക്ഷകരെയും ഇത് കാണാനും മനസ്സിലാക്കാനും അനുവദിക്കുക!	Non-anti-LGBT+ content	eng_ml
1614	naveen vnk , എന്റെ സ്കൂൾ കുട്ടിയിൽ എന്നെ 'സ്വവർഗരതി ശാസ്ത്രം' പഠിപ്പിച്ചിട്ടില്ല.. അവർ അത് നിങ്ങളെ പഠിപ്പിക്കുന്നുണ്ടോ?	Non-anti-LGBT+ content	eng_ml
1615	നിശാന്ത് ആകാശ്  സെക്ഷൻ 377 ഒരു നല്ല സന്ദേശം മാത്രമല്ല, ആകർഷണീയമായ ഒന്നാണ് ഈ നിയമം പ്രകൃതി വിരുദ്ധമാണെന്ന് പറഞ്ഞ് രണ്ട് വ്യക്തികൾ തമ്മിലുള്ള ഉഭയസമ്മതത്തോടെയുള്ള ലൈംഗിക ബന്ധത്തെ കുറ്റകരമാക്കുന്നു. നിങ്ങൾക്കറിയാത്തതിനാൽ ഇത് എന്താണെന്ന് ഗൂഗിൾ ചെയ്യണമെന്ന് ഞാൻ ആഗ്രഹിച്ചു. കൂടാതെ മെഡിക്കൽ സയൻസ് റിപ്പോർട്ടുകളും മെഡിസിൻ അടിസ്ഥാനമാക്കിയുള്ളതാണ്. ലിംഗഭേദവും ലൈംഗികതയും പരിഗണിക്കാതെയുള്ള ബലാത്സംഗം ബലാത്സംഗമാണ്, എന്നാൽ 377-ാം വകുപ്പിന് ഇതുമായി യാതൊരു ബന്ധവുമില്ല. കാലഘട്ടം.	Non-anti-LGBT+ content	eng_ml
1616	ഹായ്	Non-anti-LGBT+ content	eng_ml
1617	ഫ്രീഫയർ കളിക്കാർ	Non-anti-LGBT+ content	eng_ml
1618	അവൾ വളരെ സുന്ദരിയാണ്	Non-anti-LGBT+ content	eng_ml
1619	അവൾ സുന്ദരിയാണ്	Non-anti-LGBT+ content	eng_ml
1620	വിദ്യാഭ്യാസ സമ്പ്രദായം പതി വീഡിയോ പന്നുഗ ബ്രോ	Non-anti-LGBT+ content	eng_ml
1621	എനിയൻ സി വാട്ട് ????	Non-anti-LGBT+ content	eng_ml
1622	ബോധവൽക്കരണം സൃഷ്ടിക്കുന്ന ഒരു നല്ല വീഡിയോ മറ്റെന്തിനേക്കാളും ഉപരിയാണ്	Non-anti-LGBT+ content	eng_ml
1623	എനിക്കും അങ്ങനെ തന്നെ തോന്നുന്നു.. അവളുടെ നാണം മനോഹരമാണ്.	Non-anti-LGBT+ content	eng_ml
1624	ബ്രോ ദയവായി വിക്സിനെ കുറിച്ച് വീഡിയോ ഇടൂ.. ഇത് നല്ലതോ ചീത്തയോ?	Non-anti-LGBT+ content	eng_ml
1625	ശ്രീനിവാസൻ കണ്ണൻ  എനിക്ക് നിന്റെ കരുണ ആവശ്യമില്ല! നിങ്ങൾ മറ്റുള്ളവരുടെ ജീവിതത്തിൽ നിന്ന് മാറിനിൽക്കണം, കാരണം നിങ്ങൾ പ്രചരിപ്പിക്കുന്നത് വിദ്വേഷമാണ്!	Non-anti-LGBT+ content	eng_ml
1626	ലത്തീഫ് അഭിനയം ഗംഭീരം OK_Hand OK_Hand OK_Hand	Non-anti-LGBT+ content	eng_ml
1627	വഴിതെറ്റുക..... ഇത് എല്ലാ മതങ്ങളുടെയും നിയമങ്ങൾക്ക് എതിരാണ്.... ഈ സ്വവർഗരതി ദൈവിക നിയമങ്ങൾക്ക് എതിരാണ്...... ദൈവകോപം അവരുടെ മേൽ പതിക്കും... സൂക്ഷിക്കുക... സൂക്ഷിക്കുക.. .. സൂക്ഷിക്കുക.... #GETBACKSECTION377..... #SAYNOTOHOMOSEXUALITY.....	Homophobic	eng_ml
1628	DR Shalini madam വീഡിയോ കാണുക. ഒരാൾക്ക് മനസ്സിലാക്കാം.	Non-anti-LGBT+ content	eng_ml
1629	നന്നായി പറഞ്ഞു സഹോദരി...ഞാൻ നിങ്ങളുടെ ചിന്തകൾക്ക് അനുകൂലമാണ്...അഭിപ്രായങ്ങളും ആശയങ്ങളും..	Non-anti-LGBT+ content	eng_ml
1630	ശരിക്കും വളരെ നല്ല തീ നൂറ് പോയിന്റ് നൂറ് പോയിന്റ് % കറങ്ങുന്ന ഹൃദയം	Non-anti-LGBT+ content	eng_ml
1631	ഡച്ച് പയ്യനെ കുറിച്ച് പറയൂ സഹോദരാ.....	Non-anti-LGBT+ content	eng_ml
1632	ഇപ്പോൾ ചെന്നൈയിൽ ഹെവി ഗോപാൽ	Non-anti-LGBT+ content	eng_ml
1633	യഥാർത്ഥ സ്നേഹം ഒരിക്കലും പരാജയപ്പെടില്ല..	Non-anti-LGBT+ content	eng_ml
1634	ജീവിതാനുഭവം  കാരണം എന്റെ സുഹൃത്ത് സ്വവർഗ്ഗാനുരാഗിയായതിനാൽ പറയൂ	Non-anti-LGBT+ content	eng_ml
1635	റിയ എച്ച് നേരെ മാത്രം	Non-anti-LGBT+ content	eng_ml
1636	ഗംഭീരം. പ്രണയം ഒരിക്കലും മരിക്കുന്നില്ല, സിനിമ വളരെ സ്മൂത്ത് ആയി പോകുന്നു. നിങ്ങൾക്ക് എല്ലാവിധ ആശംസകളും നേരുന്നു.	Non-anti-LGBT+ content	eng_ml
1637	എനിക്ക് തികഞ്ഞ സ്വവർഗ്ഗാനുരാഗി സുഹൃത്തിന്റെ സ്വകാര്യ ചാറ്റുകൾ ആവശ്യമാണ്	Non-anti-LGBT+ content	eng_ml
1638	പ്രോ ദയവായി ബോക്സിംഗ് തമാശ ഭാഗം 2	Non-anti-LGBT+ content	eng_ml
1639	നല്ല ഹൃദയങ്ങളുടെ സാദൃശ്യത്തിലാണ് ദൈവം ജീവിക്കുന്നത്.	Non-anti-LGBT+ content	eng_ml
1640	എന്റെ ദയയുള്ള ഉപദേശം... നിങ്ങൾക്ക് LGBT കമ്മ്യൂണിറ്റിയിൽ ഒരു സിനിമ നിർമ്മിക്കണമെങ്കിൽ അത് മികച്ചതാക്കുക.... അന്ധമായ ആശയങ്ങളുമായി പോകരുത്... ശരിയായ അനുഭവവും അവരുടെ തീവ്രമായ വികാരങ്ങളും പുറത്തു കൊണ്ടുവരിക.... നിങ്ങൾ നല്ല ഒരു യഥാർത്ഥ ചലച്ചിത്രകാരൻ...എല്ലാ ആശംസകളും	Non-anti-LGBT+ content	eng_ml
1641	ദൈവം നിങ്ങളെ അനുഗ്രഹിക്കട്ടെ .ഞങ്ങൾ നിങ്ങൾക്കായി പ്രാർത്ഥിക്കും .വളരെ നല്ല ഹൃദയം നിറഞ്ഞ പ്രസംഗം ട്രാൻസ്‌ജെൻഡറിനെ സ്പർശിച്ചു. ഇത് സമൂഹം തീർച്ചയായും നിങ്ങളെ പോലെ എല്ലാവരെയും പിന്തുണയ്ക്കും മാഡം.	Non-anti-LGBT+ content	eng_ml
1642	സോദോം & ഗൊമോറയുടെ പാപം	Homophobic	eng_ml
