	text	category	ln
840	മറ്റ് പെൺകുട്ടികളെ കാണുന്നത് പോലെ ഞാൻ അവളെ കാണില്ല, കാരണം എല്ലാ പെൺകുട്ടികളും വ്യത്യസ്തരാണ്, എന്നാൽ നിങ്ങൾ ആകർഷണീയത കൊണ്ട് ഉദ്ദേശിക്കുന്നുവെങ്കിൽ, ഓരോ പെൺകുട്ടിയും അവരുടെ രൂപത്തിന്റെ അടിസ്ഥാനത്തിൽ വ്യത്യസ്തമാണോ? കുറച്ച് വർഷങ്ങൾക്ക് മുമ്പ് നമ്മൾ സിനിമയിൽ മാത്രം നടന്നിരുന്ന ഇന്റർകാസ്റ്റ് വിവാഹങ്ങൾ ആ കാലം ഓർക്കുന്നുണ്ടോ?? അതുകൊണ്ട് ഞാനും നീയും അടങ്ങുന്ന സമൂഹമാണ് പ്രശ്നം, അതിനാൽ ഞാനും നിങ്ങളും സമൂഹം മാറാൻ തുടങ്ങിയാൽ മാറും.	Non-anti-LGBT+ content	eng_ml
841	ആകെ വ്യത്യസ്തമായ തമ്പി ഇമോഷണൽ ടച്ച്. valthukal എല്ലാ ആശംസകളും.	Non-anti-LGBT+ content	eng_ml
842	സമൂഹത്തിനുള്ള ബോധവൽക്കരണ സന്ദേശം ബ്രോ കൈകൊട്ടി കൈകൊട്ടുക	Non-anti-LGBT+ content	eng_ml
843	ഹൃദയത്തിൽ നിന്ന് സ്പർശിക്കുക സഹോദരാ	Non-anti-LGBT+ content	eng_ml
844	അവൾ ട്രാൻസ്‌ജെൻഡർ ആണെന്ന് പറയുന്നതിൽ തെറ്റില്ല, വാസ്തവത്തിൽ അവൾ ഒന്നായതിൽ അഭിമാനിക്കുന്നു!	Non-anti-LGBT+ content	eng_ml
845	പ്ലാനിംഗ് ശരിയല്ല, പക്ഷേ ആ സഹോദരി നല്ലതാണ്	Non-anti-LGBT+ content	eng_ml
846	ഹൃദയസ്പർശിയായ ബ്രോ...	Non-anti-LGBT+ content	eng_ml
847	എന്നെ വിളിക്കുക അല്ലെങ്കിൽ മെസ്സേജ് ചെയ്യുക...	Non-anti-LGBT+ content	eng_ml
848	ഓസ്കാർ ലെവൽ അഭിനയ തമാശ ... ട്രാൻസ്ജെൻഡറിന് ആദരാഞ്ജലികൾ.	Non-anti-LGBT+ content	eng_ml
849	എല്ലാ അഭിനേതാക്കളുടെയും സെൻസിറ്റീവ്, മനോഹരമായി അണ്ടർപ്ലേ ചെയ്ത ചിത്രീകരണം - അമ്മ, അച്ഛൻ, മക്കൾ, പുരോഹിതൻ, സൈക്യാട്രിസ്റ്റ് തുടങ്ങിയവർ. നമ്മുടെ ആസ്വാദനത്തെ നശിപ്പിക്കാൻ മികച്ച അഭിനയമോ ശബ്‌ദ ഇഫക്റ്റുകളോ ഇല്ല. അതിനായി മണിശങ്കർ അയ്യർക്ക് ഒരു വലിയ ഹൈ-ഫൈവ്. ഒന്നോ രണ്ടോ കണ്ണുനീർ തുടയ്ക്കുന്നത് ഞാൻ കണ്ടെത്തി.	Non-anti-LGBT+ content	eng_ml
850	എക്കാലത്തെയും മികച്ച വീഡിയോകളിൽ ഒന്ന്!! സ്ത്രീയെ ബഹുമാനിക്കുക !!	Non-anti-LGBT+ content	eng_ml
851	നിങ്ങളുടെ പ്രവർത്തനം നന്നായിരുന്നു. ആ അക്ക തന്റെ മാതൃത്വം വെളിപ്പെടുത്തി. നിങ്ങളുടെ ശ്രമത്തിന് ആശംസകൾ	Non-anti-LGBT+ content	eng_ml
852	അത് പാശ്ചാത്യ സംസ്കാരമല്ല തറയിൽ_ചിരിക്കുന്ന_തറയിൽ_ചിരിക്കുന്ന_തറയിൽ_ചിരിക്കുന്നു	Non-anti-LGBT+ content	eng_ml
853	ബിഹൈൻഡ്‌വുഡ്‌സിൽ നടന്ന ഈ ടീമിന്റെ അഭിമുഖം കണ്ടിട്ട് വർഷങ്ങളോളം ഇത് തിയേറ്ററുകളിൽ റിലീസ് ചെയ്യാൻ ഞാൻ കാത്തിരുന്നു, ഒടുവിൽ ഇപ്പോൾ ഞാൻ സന്തോഷവാനാണ്.	Non-anti-LGBT+ content	eng_ml
854	നിങ്ങൾക്കറിയാമോ സഹോദരാ ഇത് എന്റെ ആദ്യ സബ്സ്ക്രൈബ് ചാനൽ ആണ്	Non-anti-LGBT+ content	eng_ml
855	അതെ.. അവളുടെ മനോഭാവം ശരിക്കും അതിശയകരമാണ്.. എനിക്ക് അവളെ ഇഷ്ടമാണ്.. സഹോദരി നിങ്ങളുടെ വഴിയിൽ തുടരുക.. ഞാൻ നിങ്ങളെ എപ്പോഴും പിന്തുണയ്ക്കുന്നു.	Non-anti-LGBT+ content	eng_ml
856	മനുഷ്യർ മൃഗങ്ങളായി മാറുകയാണ്. മൃഗങ്ങൾ പോലും ഈ സമ്പ്രദായം അവലംബിക്കുന്നത് അനുയോജ്യമായ പങ്കാളിയെ ലഭ്യമല്ലാത്ത സമയത്താണ്.	Non-anti-LGBT+ content	eng_ml
857	നല്ല ജോലി തംബ്സ് അപ്പ് തംബ്സ് അപ്പ്, നിങ്ങളിൽ ഞാൻ അഭിമാനിക്കുന്നു സഹോദരാ	Non-anti-LGBT+ content	eng_ml
858	ഗംഭീര അഭിമുഖം ധനുഷ് ശൈലിയിലുള്ള പ്രസംഗം	Non-anti-LGBT+ content	eng_ml
859	ഇത്രയും മനോഹരമായ ഒരു സിനിമ ചിരിക്കുന്ന_മുഖം_ഹൃദയം-കണ്ണുകളുള്ള മഴവില്ല് മനുഷ്യർ_കൈകളിൽ_ചുവന്ന_ഹൃദയം നന്ദി മിസ്റ്റർ ലോകേഷിനും ടീമിനും	Non-anti-LGBT+ content	eng_ml
860	നിങ്ങൾ സുന്ദരിയാണ്.	Non-anti-LGBT+ content	eng_ml
861	ഇത് സ്ക്രിപ്റ്റഡ് എപ്പിസോഡാണെന്ന് ഞാൻ കരുതുന്നു, പക്ഷേ കൊള്ളാം	Non-anti-LGBT+ content	eng_ml
862	വാൾതുക്കൽ. നിങ്ങളുടെ വീഡിയോയ്ക്ക്.. സ്വവർഗരതി. അർത്ഥം ലൈംഗികത എന്ന രീതി	Non-anti-LGBT+ content	eng_ml
863	ഇത് അംഗീകരിക്കാൻ കഴിയുമെങ്കിൽ, അഗമ്യഗമനം നടത്തുന്നവരുടെ കാര്യമോ?! ആരെങ്കിലും മൃഗങ്ങളുമായി ബന്ധം പുലർത്താൻ ആഗ്രഹിക്കുന്നുവെങ്കിൽ?!... അതും വികാരങ്ങൾ ശരിയാണോ?! ; ; ചോദ്യം, അത് സ്വാഭാവികമാണോ അല്ലയോ, മറിച്ച് അത് ധാർമ്മികതയെ ബാധിക്കുമോ? ..... ; ; നാം മൃഗങ്ങളെ പിന്തുടരേണ്ട ഒരു ഉദാഹരണമായി കാണരുത്, ചില മൃഗങ്ങൾ അവരുടെ നവജാതശിശുക്കളെ ഭക്ഷിക്കുന്നത് വളരെ സ്വാഭാവികമാണ്.	Homophobic	eng_ml
864	ലെസ്ബിയൻ ആയാലും സ്വവർഗാനുരാഗി ആയ ദമ്പതികളായാലും, ഒരു അനാഥ കുട്ടിയെ പൊരുത്തപ്പെടുത്തിക്കൊണ്ട് അവരുടെ കുടുംബം വികസിപ്പിക്കാൻ അവർ തയ്യാറാകുമ്പോൾ ആ ചിന്തയെ ഞാൻ അഭിനന്ദിക്കുന്നു. എന്നാൽ ചില ഭിന്നലിംഗ ജോഡികൾ ഒരു കുഞ്ഞിന് ജന്മം നൽകി അനാഥരായി പോയി. അവരെ എന്ത് വിളിക്കും?	Non-anti-LGBT+ content	eng_ml
865	മികച്ച ജോലിയും സൂപ്പർ സന്ദേശവും	Non-anti-LGBT+ content	eng_ml
866	8.00 കണ്ണുനീർ യഥാർത്ഥ ചുവന്ന ഹൃദയമായിരുന്നു	Non-anti-LGBT+ content	eng_ml
867	അവൾ ഒരു ട്രാൻസ്‌ജെൻഡർ മുഖം_തുറന്ന_വായ് കാണുന്നില്ല, അവൾ സുന്ദരിയായി കാണപ്പെടുന്നു, പക്ഷേ അവളുടെ ശബ്ദം മോശമായ മുഖമാണ്_സന്തോഷത്തിന്റെ_കണ്ണുനീർ നിറഞ്ഞതാണ്	Non-anti-LGBT+ content	eng_ml
868	ആണിനോട് ആണോ പെണ്ണിനോട് പെണ്ണോ ആകണം പ്രകൃതിക്ക് എതിരാണെന്ന് നിങ്ങൾ പറയുന്നത് പോലെ സ്വാഭാവികമായി വരുന്നു!!!	Non-anti-LGBT+ content	eng_ml
869	*അത് അവരുടെ സ്വന്തം തോന്നലാണ്...അതിരിക്കട്ടെ...	Non-anti-LGBT+ content	eng_ml
870	സിസ്റ്റർ മാലിനി പ്ലീസ് പശ്ചാത്തപിക്കുക യേശുവേ പ്ലീസ് പശ്ചാത്തപിക്കുക യേശുക്രിസ്തു വരുന്ന സ്വവർഗാനുരാഗ പാവം plz puringikkonga	Non-anti-LGBT+ content	eng_ml
871	പ്രോത്സാഹിപ്പിച്ചുകൊണ്ട് ഒരാൾക്ക് സ്വവർഗ്ഗാനുരാഗിയോ ലെസ്ബിയനോ ആവാൻ കഴിയില്ല... അതാണ് അഭിമുഖത്തിന്റെ പ്രസക്തി.. ഇത് സ്വാഭാവികമായ കാര്യമാണ്... നിങ്ങൾ സ്വവർഗ്ഗാനുരാഗിയാണെങ്കിൽ നിങ്ങൾ സ്വവർഗ്ഗാനുരാഗിയാണ്.. നിങ്ങൾ അത് ശ്രദ്ധിക്കാൻ സമയമെടുക്കൂ... ആളുകൾക്ക് വിദ്യാഭ്യാസം ആവശ്യമാണ്.. അത്രയേയുള്ളൂ... അവൾ നിങ്ങളെ സ്വവർഗ്ഗാനുരാഗി ആകാൻ പ്രോത്സാഹിപ്പിക്കുന്നില്ല... അവളെ അങ്ങനെ ജീവിക്കാൻ അനുവദിക്കണമെന്നാണ് അവൾ ഞങ്ങളോട് ആവശ്യപ്പെടുന്നത്. മറ്റ് സാധാരണ മനുഷ്യർ ആയിരിക്കും	Non-anti-LGBT+ content	eng_ml
872	രണ്ടാം ഭാഗം അടുത്ത വർഷം....	Non-anti-LGBT+ content	eng_ml
873	കൊള്ളാം ചേച്ചി.. വിഷമിക്കണ്ട	Non-anti-LGBT+ content	eng_ml
874	മണിശങ്കർ അയ്യർ  സന്തുഷ്ടി എന്റേതാണ്, അയ്യർ സാഹിബ്! പ്രത്യേകിച്ച് എൽജിബിടി ബന്ധങ്ങളുടെ മേഖലയിൽ നിങ്ങളുടെ ഗുണമേന്മയുള്ള കൂടുതൽ പ്രവൃത്തികൾ കൊണ്ട് ഞങ്ങളെ ആകർഷിക്കുക!!	Non-anti-LGBT+ content	eng_ml
875	എഡിറ്റർ രമ്യ ആരാധകർ ഇവിടെ പോലെ അടിച്ചു.... തറയിൽ_ഉരുളുന്നു_തറയിൽ_ചിരിക്കുന്നു.	Non-anti-LGBT+ content	eng_ml
876	ദിനേശ് ബാബു അവർ ചെയ്യില്ല.. കാരണം അവരുടെ മതം അതിനെ പിന്തുണയ്ക്കുന്നില്ല... ഇന്ത്യയിൽ അങ്ങനെയല്ല.. ഞങ്ങൾ എന്നും നിലവിലുണ്ട്.	Non-anti-LGBT+ content	eng_ml
877	മാലിൻ പ്രിയേ.. നിന്നെ ഒരുപാട് സ്നേഹിക്കുന്നു.. red_heart	Non-anti-LGBT+ content	eng_ml
878	അദേ... LGBT ഒരു പ്രകൃതിയാണ്... 1st നിങ്ങൾ മനസ്സിലാക്കണം പ്രകൃതി എന്താണെന്നും പ്രകൃതി എന്താണെന്നും...	Non-anti-LGBT+ content	eng_ml
879	ഞാൻ അത് സമ്മതിക്കുന്നു	Non-anti-LGBT+ content	eng_ml
880	അച്ഛൻ 10 മടങ്ങ് കൂടുതൽ ക്രൂരനും ഇടുങ്ങിയ ചിന്താഗതിക്കാരനും ആയിരിക്കും - യാഥാർത്ഥ്യം വിയർപ്പുള്ള_മുഖം	Non-anti-LGBT+ content	eng_ml
881	ജെയിംസ് ഐറിൻ റെയിൻബോ പവർ !!!	Non-anti-LGBT+ content	eng_ml
882	0.001% ആളുകളിൽ ഒരാളാകാൻ ഞാൻ ആഗ്രഹിക്കുന്നു ...	Non-anti-LGBT+ content	eng_ml
883	പ്രിയ സാർ, എന്റെ കമന്റ് ഒരു തമാശ മാത്രമായിരുന്നു. ഈ സിനിമയും ഇതിലെ കഥാപാത്രങ്ങളും ഗംഭീരമാണ്, എന്റെ കാഴ്ചപ്പാടിൽ നിങ്ങൾ ഒന്നും മാറ്റേണ്ടതില്ല.; രണ്ടുപേരും അവരുടെ ജോലിയിൽ മികച്ചവരാണ്	Non-anti-LGBT+ content	eng_ml
884	ആദ്യമായി unga channel ah paakuren keep rock with love black_heart	Non-anti-LGBT+ content	eng_ml
885	അശോക് കുമാർ  pls. നിങ്ങളുടെ കോൺടാക്റ്റ് വിശദാംശങ്ങൾ പങ്കിടുക, ഞാൻ നിങ്ങളെ വിളിക്കാം.	Non-anti-LGBT+ content	eng_ml
886	ഹൃദയസ്പർശിയായ പ്രണയകഥ!	Non-anti-LGBT+ content	eng_ml
887	കൊള്ളാം ബ്രോ നന്നായി ശ്രമിച്ചു	Non-anti-LGBT+ content	eng_ml
888	ദൈവം നിന്നെ അനുഗ്രഹിക്കട്ടെ	Non-anti-LGBT+ content	eng_ml
889	സ്വന്തം ലിംഗഭേദത്തോടുള്ള സ്നേഹമാണ് അത് പാപമല്ല	Non-anti-LGBT+ content	eng_ml
890	m/s ഖുശ്ബു കാര്യങ്ങൾ ഉൾപ്പെടുന്ന തന്റെ രണ്ട് മകളെ പിന്തുണയ്ക്കും..?!	Homophobic	eng_ml
891	അടുത്ത ഭാഗത്തിനായി ഞാൻ വരുന്നു സഹോദരാ...	Non-anti-LGBT+ content	eng_ml
892	എന്തുകൊണ്ട് പോലീസ് അവരെ അറസ്റ്റ് ചെയ്യുന്നില്ല?	Non-anti-LGBT+ content	eng_ml
893	സൂക്ഷിക്കുക, ആത്മവിശ്വാസം പുലർത്തുക. കുഴപ്പമില്ല	Non-anti-LGBT+ content	eng_ml
894	മനഃശാസ്ത്രത്തെയും വലരമുറൈയെയും അടിസ്ഥാനമാക്കിയുള്ള സ്വവർഗരതിയാണെന്ന് ഞാൻ കരുതുന്നു	Non-anti-LGBT+ content	eng_ml
895	വൗ! അവളുടെ മനോഭാവം അത് ഇഷ്ടപ്പെട്ടു. ധീരമായ പ്രസംഗം	Non-anti-LGBT+ content	eng_ml
896	സബ്സ്ക്രൈബ് പാനിറ്റൻ ഒരുപാട് കരഞ്ഞു, ഹാർട്ട്_സ്യൂട്ട് ഹാർട്ട്_സ്യൂട്ട് ഹാർട്ട്_സ്യൂട്ട്	Non-anti-LGBT+ content	eng_ml
897	വിധിയേക്കാൾ ശരിയാണ്	Non-anti-LGBT+ content	eng_ml
898	രേഖ എസ് നല്ല വിശദീകരണം. ഒരു നേരായ പയ്യൻ ഒരു ട്രാൻസ് വിവാഹം കഴിച്ചാൽ.. അത് ആളെ ആക്കില്ലേ.. ഹോമി..! കുഡോസ്.. ഐഡിസി.. വെറുപ്പില്ല. luv പരത്തുക. ബബി.	Non-anti-LGBT+ content	eng_ml
899	മൂന്നാം ക്ലാസ് പ്രോഗ്രാം	Non-anti-LGBT+ content	eng_ml
900	ഞാൻ അംഗീകരിക്കുന്നു	Non-anti-LGBT+ content	eng_ml
901	അഭിനയം നിലവാരം പുലർത്തുന്നു.	Non-anti-LGBT+ content	eng_ml
902	സെക്ഷൻ 377 പ്രോത്സാഹിപ്പിക്കുന്നത് ഒരു നല്ല സന്ദേശം മാത്രമല്ല, അതിശയകരമായ ഒരു സന്ദേശവുമാണ്. ആരെങ്കിലും ഒരാളെ അവരോടൊപ്പം ഉറങ്ങാൻ നിർബന്ധിക്കുന്നുണ്ടോ എന്നത്, അത് സ്വവർഗ്ഗാനുരാഗിയോ നേരായതോ എന്നത് പരിഗണിക്കാതെ തന്നെ തെറ്റാണ്. ആരെങ്കിലും ഒരു സ്വവർഗ്ഗാനുരാഗിയെ പരിവർത്തനം ചെയ്യാൻ ശ്രമിക്കുന്നുണ്ടെങ്കിൽ, അവർക്ക് കഴിയില്ല. മറ്റൊരാൾ സ്വവർഗ്ഗാനുരാഗിയാണെങ്കിൽ മാത്രമേ അയാൾക്ക് അത് ഇഷ്ടപ്പെടൂ. ഇല്ലെങ്കിൽ അവൻ നിരസിക്കും. മറുവശത്ത് നിന്ന് നിരസിച്ചതിന് ശേഷവും നിർബന്ധിച്ചാൽ അത് ക്രിമിനൽ കുറ്റമാണ്. ഒരു പുരുഷനിൽ നിന്ന് സ്ത്രീയിലേക്കോ സ്ത്രീയിൽ നിന്ന് പുരുഷനിലേക്കോ പുരുഷനിൽ നിന്ന് മറ്റൊരു പുരുഷനിലേക്കോ സ്ത്രീയിൽ നിന്ന് മറ്റൊരു സ്ത്രീയിലേക്കോ ആയാലും അതിന്റെ ലൈംഗികാതിക്രമം. അത് ഇപ്പോഴും കുറ്റകൃത്യമാണ്. എന്നിരുന്നാലും, ആരെങ്കിലും ശ്രമിക്കുന്നതുകൊണ്ട് മാത്രം ഒരു വ്യക്തിക്കും അവന്റെ അല്ലെങ്കിൽ അവളുടെ ലൈംഗികത മാറ്റാൻ കഴിയില്ല.	Non-anti-LGBT+ content	eng_ml
903	വളരെ നന്നായി പറഞ്ഞു :) പ്രയത്നത്തിന് അഭിനന്ദനങ്ങൾ. ആശംസകൾ!	Non-anti-LGBT+ content	eng_ml
904	ബ്രോ ചെറിയ തിരുത്ത് അത് ആർട്ടിക്കിൾ അല്ല അത് സെക്ഷൻ 377 IPC ആണ്	Non-anti-LGBT+ content	eng_ml
905	ഇവിടെ എവിടെയാണ് ശല്യം	Non-anti-LGBT+ content	eng_ml
906	അത് പൂർണ്ണമായും ദൈവത്തിന് എതിരാണ്	Homophobic	eng_ml
907	ഇത് തപ്പുനു സുന്ന യെല്ലരും കൂടുതലും വിദ്യാഭ്യാസമില്ലാത്തവരാണ്	Non-anti-LGBT+ content	eng_ml
908	സൂപ്പർ crt സൊനിങ്ക	Non-anti-LGBT+ content	eng_ml
909	അവൾ സുന്ദരിയാണ്, അവൾ ഒരു ലളിതമായ ശുദ്ധ സുന്ദരിയാണ്	Non-anti-LGBT+ content	eng_ml
910	മാഗിസ്‌വാൻ ഫൗണ്ടേഷൻ നീണാൾ വാഴട്ടെ	Non-anti-LGBT+ content	eng_ml
911	ബ്ലാക്ക് ഷീപ്പ്  ഞാനാണ് ആ സിനിമയുടെ സംവിധായകൻ	Non-anti-LGBT+ content	eng_ml
912	ഇത് ശുദ്ധമായ ക്രോമസോം തകരാറാണ്. ആരും സ്വമേധയാ അവരുടെ ജനിതകമാറ്റം വരുത്തിയില്ല. ദയവായി ചില പുസ്തകങ്ങൾ ചോദിക്കുക അല്ലെങ്കിൽ റഫർ ചെയ്യുക	Non-anti-LGBT+ content	eng_ml
913	കായത്രി ദേവി ഉറപ്പാണ്. കൂടുതൽ പര്യവേക്ഷണം ചെയ്യുക, നിങ്ങൾ പ്രതീക്ഷിച്ചതിലും കൂടുതൽ പഠിക്കാൻ കഴിയും. അതിൽ ഭാഗ്യം. :)	Non-anti-LGBT+ content	eng_ml
914	അതെ ...അവൾ അത് മാത്രമേ പറഞ്ഞിട്ടുള്ളൂ....പാവം... സ്ഥിരതയുള്ള_മുഖം സ്ഥിരതയുള്ള_മുഖം	Non-anti-LGBT+ content	eng_ml
915	ഈ കഥ സമയം പാഴാക്കുന്നത് എനിക്ക് മനസ്സിലാകുന്നില്ല	Non-anti-LGBT+ content	eng_ml
916	അനിയത്തിയെ വിവാഹം കഴിച്ച ആളുടെ ജീവിതത്തിലും ഇതുതന്നെ സംഭവിച്ചു... അവൻ ഒരു വഞ്ചകനായിരുന്നു.. എന്റെ സഹോദരി അവിടെ ഒരുപാട് കഷ്ടപ്പെട്ടു... വിവാഹം കഴിഞ്ഞ് 3 മാസത്തിനുള്ളിൽ ഞങ്ങൾ അവളെ വീട്ടിലെത്തിച്ചു... ഞങ്ങൾക്ക് അവളെ കാണാൻ കഴിയില്ല ഈ പ്രായത്തിൽ തന്നെ സമൂഹത്തിൽ വ്യക്തിപരമായി സ്വാധീനം ചെലുത്തുന്നു... അതിനാൽ വിവാഹത്തിന് മുമ്പ് ദയവായി അത് അറിഞ്ഞിരിക്കുക plz plz.... വിവാഹത്തിന് മുമ്പ് തന്നെ വ്യക്തിയെക്കുറിച്ച് കൂടുതൽ വിവരങ്ങൾ ശേഖരിക്കാൻ ശ്രമിക്കുക... ഒടുവിൽ എന്റെ സഹോദരിയെ ഈ ക്രൂരമായ വിവാഹം ബാധിച്ചു_മുഖം_മുഖം ചെറുതായി_മുഖം_മുഖം_ചെറുതായി_മുഖം_മുഖം	Non-anti-LGBT+ content	eng_ml
917	ആദ്യമായി ഒരു പ്രാങ്ക് ഷോ കണ്ട് കരഞ്ഞു..; അവൾ ആ പയ്യനുവേണ്ടി നൃത്തം ചെയ്തപ്പോൾ, അക്ഷരാർത്ഥത്തിൽ ഞാൻ കരഞ്ഞു_മുഖം	Non-anti-LGBT+ content	eng_ml
918	ക്ഷമിക്കണം സഹോദരാ	Non-anti-LGBT+ content	eng_ml
919	നിങ്ങൾ ടെലിവിഷൻ നടി വാണി ഭോജനെപ്പോലെയാണ്. നിങ്ങൾ വളരെയധികം കടന്നുപോയി, സെന്നിലാ ധൈര്യമായിരിക്കുക, നിങ്ങൾക്ക് ഒരുപാട് സ്നേഹവും അനുഗ്രഹങ്ങളും	Non-anti-LGBT+ content	eng_ml
920	ഹിന്ദുമതത്തിൽ അന്ന, സ്വവർഗരതി വളരെ പ്രബലമായിരുന്നു. കൊണാർക്ക് സൂര്യക്ഷേത്രം, ഖജുരാഹോ ക്ഷേത്രം, 1000 വർഷത്തിലേറെ പഴക്കമുള്ള മറ്റ് ക്ഷേത്രങ്ങൾ എന്നിവയിലെ കൊത്തുപണികൾ കാണുക.	Non-anti-LGBT+ content	eng_ml
921	വിശ്വനാഥൻ സ്വാമിനാഥൻ  ക്ഷമിക്കണം വീണ്ടും ടൈപ്പിംഗ് പിശക് വീണ്ടും ചെന്നൈയിൽ ജോലി ചെയ്യാൻ അവസരം ലഭിച്ചു അടുത്ത ആഴ്ചയോടെ ചെന്നൈയിൽ ചേരും എനിക്കുള്ളതിൽ സന്തോഷമുണ്ട്	Non-anti-LGBT+ content	eng_ml
922	മനോഹരമായ പ്രണയകഥ.. എനിക്കിത് ശരിക്കും ഇഷ്ടമാണ്. ഹൃദയങ്ങളെ തൊട്ടുണർത്തുന്നു.. കരയുന്ന മുഖം കരയുന്ന മുഖം കരയുന്ന മുഖം	Non-anti-LGBT+ content	eng_ml
