	text	category	ln
1232	गरीबों की मदद करें और भगवान आपको सौ साल तक बेहतर जीवन देंगे	Non-anti-LGBT+ content	eng_hin
1233	भाई मेरा दिल दुखता है भाई.. वास्तव में उस बहन के लिए सम्मान है... हाथ जोड़कर	Non-anti-LGBT+ content	eng_hin
1234	नाग रत्न	Non-anti-LGBT+ content	eng_hin
1235	आप ट्रांसजेंडर दिमाग वाले फ्रैंक के नाम से क्यों आहत हैं?	Non-anti-LGBT+ content	eng_hin
1236	देखिए आप सब कुछ हैं। एक जेनमामा। शर्म। दर्द शर्म। face_savoring_food ओग्रे face_savoring_food	Non-anti-LGBT+ content	eng_hin
1237	बड़े ट्रांसजेंडर एक गिरोह का नेतृत्व करते हैं और अनुत्तरदायी लड़कों का ख्याल रखते हैं और उन्हें इच्छा के शब्दों को बताते हैं और उन्हें खींचकर ट्रांसजेंडरों के पास ले जाते हैं।ट्रांससेक्सुअल का लाभ उठाते हुए, वे इच्छा के कई शब्दों के साथ अपना मन बदलते हैं और बड़े शहरों में लाखों में बेचे जाते हैं रुपये वे रास्ता दिखाएंगे	Transphobic	eng_hin
1238	वेतन के लिए क्षमा करें गुलाब! मैंने गलत सोचा क्योंकि आपने ऐसा कहा था।	Non-anti-LGBT+ content	eng_hin
1239	आपको प्यार हो रहा है सेमा। ऐसा कभी किसी ने नहीं सुना	Non-anti-LGBT+ content	eng_hin
1240	अपनी आँखें बंद रखो मेरे दोस्त	Non-anti-LGBT+ content	eng_hin
1241	मुझे लगता है कि मुंबई से सभी 9 तमिलनाडु आएंगे !!!!	Transphobic	eng_hin
1242	सुंदर तमिल महिला को नमस्कार, जिसने सुंदर तमिल में सुंदर उच्चारण के साथ इस समाज के दर्द को इतनी खूबसूरती से सहा	Non-anti-LGBT+ content	eng_hin
1243	बहुत सी महिलाएं 'थम्स अप' या 'फ्रैंक' कहकर पुरुषों को ठेस पहुंचा रही हैं। हंसी जरूरी है लेकिन बहुत ज्यादा नहीं।	Non-anti-LGBT+ content	eng_hin
1244	वही चीज़ मेरे साथ हुई	Non-anti-LGBT+ content	eng_hin
1245	लियो सूरज	Non-anti-LGBT+ content	eng_hin
1246	समलैंगिकता अपराध है व्यभिचार अपराध है या नहीं? कोई वकील इस सवाल को जनहित याचिका के तौर पर अदालत में दाखिल करे तो अच्छा है!	Homophobic	eng_hin
1247	सुखी जीवन में संघर्ष की अहम बात सबको जाननी चाहिए,; ; खुश प्यार वास्तव में वासना के बारे में नहीं है; ; खुश प्यार वास्तव में; प्यार सिर्फ वासना के लिए होता है। इंद्रधनुष_झंडा; ; इन सभी को महसूस किया जाना चाहिए और समझा जाना चाहिए।; ; प्यार फैलाएं और दुनिया को थम्स_अप फैलाएं	Non-anti-LGBT+ content	eng_hin
1248	सेनीला, तुम अच्छा बोलती हो, तुम सुंदर हो, तुम्हारी सामाजिक देखभाल अच्छी है, चिंता मत करो तुम ठीक हो जाओगे। भगवान तुम्हारा भला करे।	Non-anti-LGBT+ content	eng_hin
1249	अगर आपके पिता भी आपकी तरह सोचते और एक भी सेक्सिस्ट रखते तो क्या अब आप नकीरन पत्रिका में ऐसी बात कर रहे होते...	Homophobic	eng_hin
1250	प्रो उन्हें मूर्ख मत बनाओ_जोड़ा_हाथ_जोड़ा_हाथ_जोड़ा_हाथ उन पर विश्वास करो यह कोई खेल नहीं है	Non-anti-LGBT+ content	eng_hin
1251	डू डू डू डू डू	Non-anti-LGBT+ content	eng_hin
1252	देई देविडिया देविडिया देविडिया बिया एंगडा साड़ी शो बुंदा मवाने	Non-anti-LGBT+ content	eng_hin
1253	सीधी बात तुम जैसी, हमारी तरह, हमारा मजाक मत बनाओ।	Non-anti-LGBT+ content	eng_hin
1254	उनके लिए मरा हुआ कुत्ता और भूत का बच्चा एक ही चीज है	Homophobic	eng_hin
1255	यह झूठा और अलौकिक है। यह सोचकर दुख होता है कि जिस जज ने फैसला सुनाया, उसे वह ज्ञान भी नहीं है, जो एक जानवर को होता है।	Homophobic	eng_hin
1256	थम्स_अप स्माइलिंग_फेस_विद_ओपन_हैंड्स सुपर ये सभी बातचीत चिंताजनक हैं	Non-anti-LGBT+ content	eng_hin
1257	100% check_mark हम एक दोस्त में हर तरह का सुख ले सकते हैं, जो एक पत्नी में संभव नहीं है।महान मित्र।	Non-anti-LGBT+ content	eng_hin
1258	प्रभु यीशु मसीह आपसे लाल_हृदय पीला_हृदय_नीला_हृदय प्रेम करते हैं	Non-anti-LGBT+ content	eng_hin
1259	सबके लिए धन्यवाद...	Non-anti-LGBT+ content	eng_hin
1260	गाय की करी खाने वाली कन्या	Transphobic	eng_hin
1261	जब भी हम स्कूल में पढ़ते हैं, हम भारत में समलैंगिक समलैंगिकों के बारे में नहीं सुनते हैं, जब हम कॉलेज जाते हैं, विदेशों में लोगों द्वारा समलैंगिकों पर हमला किया जाता है, जब समाचार पथ 2018 समाप्त होता है, तमिलनाडु में इस प्रकार का नियम अधिक आम है। यह अप्राकृतिक है। मैं पांच साल से पियक्कड़ हूं और पांच साल से मुझे डांट-फटकार भी मारी है।जब मैं समलैंगिकों को देखता हूं तो मुझे जलन होती है। क्यों मैं केवल अपने उभयचर आंख मारने_वाले_चेहरे_से_जीभ से आकर्षित हूं	Non-anti-LGBT+ content	eng_hin
1262	मदन द्रविड़ियन क्या है? द्रविड़म। तमिलदेशीयम में क्या हुआ? कुछ दल द्रविड़वाद का पालन करते हैं। कुछ पार्टियां तमिल Tamildesiyathnam को फॉलो करती हैं तो अंतर बताएं।	Non-anti-LGBT+ content	eng_hin
1263	यह है। विरोध किया। ठीक है। वह है जैसा बच्चा . धन। उसका जन्म होगा अभिवादन। आदी.....	Non-anti-LGBT+ content	eng_hin
1264	क्या खूबसूरती है आप सामी सामी कहते हैं	Non-anti-LGBT+ content	eng_hin
1265	यदि कोई ट्रांसजेंडर दुर्व्यवहार करता है तो वह पुलिस विभाग में शिकायत दर्ज करा सकता है	Non-anti-LGBT+ content	eng_hin
1266	पन्नुआनाला समलैंगिक पनुरवंगटाना जैसे इस घिनौने वीडियो के लिए 5 मिलियन लाइक। कोई शर्म नहीं। ची थू। समलैंगिक एड्स की घातक बीमारी फैला रहे हैं। क्या आप हत्यारे हैं। आपकी अच्छी मौत नहीं होगी। आपको तह तक जाने के लिए लड़ना चाहिए। आपका मृत्यु परमाणु यातना से होगी। मनुष्य के जीवनकाल में मृत्यु कल भगवान होगी। यदि यह ज्ञात हो जाता है और जीवित रहने के लिए भेजा जाता है, तो मानव जाति गलतियाँ करने से जाग जाएगी। आप जैसे समलैंगिकों को आने वाली मृत्यु से अवगत कराया जाना चाहिए मैं उसके लिए अपने भगवान से प्रार्थना करता हूं।	Homophobic	eng_hin
1267	आप जिस तरह से सामाजिक विचार और सच्चाई साझा करती हैं वह अद्भुत है..बधाई हो बहन..	Non-anti-LGBT+ content	eng_hin
1268	जैसे-जैसे पाप बढ़ेगा, संसार नष्ट हो जाएगा	Homophobic	eng_hin
1269	भाई नींगा थप्पा पुरिनजिरुकिंगा; यह भगवान की गलती नहीं है.; (ट्रांसजेंडर) हार्मोनल परिवर्तन के कारण ट्रांसजेंडर लोग बदल जाते हैं, लेकिन समलैंगिकता (समलैंगिक) के गलत माहौल में पल रही पीढ़ियां एक बहुत बड़ी गलती है। जब यह विचार मन में आता है, तो इसे बड़ों को सुधारना चाहिए, रिश्तेदारों को नहीं। यह बड़ी शर्म की बात है। इसका समर्थन न करें, जितना हो सके दूसरों को ठीक करने का प्रयास करें; हमारा समाज हमारे लोग हैं; ; यीशु तुम्हें आशीर्वाद दे	Homophobic	eng_hin
1270	पुरुषों को पसंद न करने वाली महिलाएं अगर इस रास्ते पर चलेंगी तो पुरुषों को नुकसान होगा	Non-anti-LGBT+ content	eng_hin
1271	समलैंगिक समलैंगिक समावेश के कारण जनसंख्या में कमी अच्छी है लेकिन प्राकृतिक-विरोधी कार्रवाई बेकार है।	Homophobic	eng_hin
1272	बढ़िया पोस्ट है यार	Non-anti-LGBT+ content	eng_hin
1273	हमें अंतरात्मा, विश्वासियों और ईश्वर के प्रति ईमानदार होना चाहिए, हमें नैतिकता को जीवन से ऊपर मानना ​​चाहिए, हमें दूसरों की संपत्ति के लिए लालची नहीं होना चाहिए, हमारे कार्य हमारे दिल की इच्छा के अनुसार नहीं होने चाहिए, हमें किसी को भी राजी करके लाभ नहीं उठाना चाहिए, हमें झूठ नहीं बोलना चाहिए, हमें दूसरे जीवन का सम्मान करना चाहिए, आदि। मनुष्य को अपने जीवन को अपनी इच्छा के अनुसार बनाने और उसके अनुसार जीने का पूर्ण अधिकार और स्वतंत्रता है।; मैं तहे दिल से कोर्ट के इस फैसले का समर्थन करता हूं और दिल से स्वीकार करता हूं।	Non-anti-LGBT+ content	eng_hin
1274	अन्ना सुपर सिस्टर लाइव सौ_पॉइंट सौ_पॉइंट सौ_पॉइंट सौ_पॉइंट सौ_पॉइंट सौ_पॉइंट सौ_पॉइंट सौ_पॉइंट	Non-anti-LGBT+ content	eng_hin
1275	नालू प्रति सर्दंडु (......) उच्चचा साड़ी ...... सामान्य	Non-anti-LGBT+ content	eng_hin
1276	वे बस में परेशानी बर्दाश्त नहीं कर सकते। आपको 10 रुपये देने होंगे नहीं तो वे आपको गाली देंगे	Transphobic	eng_hin
1277	मैं वेंकटेश वड़ा ऐताकारी मुंडा..आपती गुनी हूं	Non-anti-LGBT+ content	eng_hin
1278	भाई मेरा दिल दुखता है भाई.. सच में उस बहन के लिए सम्मान...जोड़ा_हाथ_जोड़ा_हाथ_जोड़ा_हाथ_जोड़ा_हाथ_लाल_दिल_लाल_दिल_लाल_दिल_लाल_दिल_लाल_दिल_अंगूठे_ऊपर_अंगूठे_ऊपर_अंगूठा ऊपर	Non-anti-LGBT+ content	eng_hin
1279	इतना अच्छा काम करने के लिए धन्यवाद	Non-anti-LGBT+ content	eng_hin
1280	हे देवीडिया, कृपया इस सब का एक वीडियो पोस्ट करें	Non-anti-LGBT+ content	eng_hin
1281	आप जो कर रहे हैं वह निंदनीय है। यह हमारी कुछ सच्ची मित्रता के नुकसान का कारण भी बन सकता है। यह दुख की बात है कि आप इस तरह बात करते हैं, यह जानते हुए कि हमें घूरने/संदिग्ध रूप से देखने/अलग तरह से देखने के कितने तरीके हैं। ऐसा केवल वही सोच सकता है जो चारों ओर से केवल वासनापूर्ण लाभ चाहता है।	Homophobic	eng_hin
1282	मैं आपकी भावनाओं की कद्र करता हूं लेकिन मुझे आप पर गुस्सा तभी आता है जब आप नाराज होते हैं। मुझे दो लोगों ने पीटा है, जिन्होंने शौचालय और बस में लाइन पार की। आपको अपनी भावनाओं को केवल उन लोगों के साथ रखना चाहिए जिनके पास आपकी भावनाएं हैं। लाइन के साथ लाइन पार करना अन्य एक अपराध है।	Non-anti-LGBT+ content	eng_hin
1283	हर किसी की अलग फीलिंग होती है... कानून समलैंगिकता को सही कहता है.. यह उनकी मर्जी है.. हमें गलत कहने का कोई अधिकार नहीं है..	Non-anti-LGBT+ content	eng_hin
1284	एंकरिंग स्टाफ दिमाग को लात मारना चाहता था, लेकिन पेरुसा ने आकर माइक उठा लिया। सरकार की मंजूरी देने से आपको और मुझे क्या लेना-देना?	Non-anti-LGBT+ content	eng_hin
1285	पॉल दिनाकरन के कॉलेज की फीस 2 लाख.... पहले उसे बाइबिल का श्लोक सुनाओ....	Non-anti-LGBT+ content	eng_hin
1286	मेरे प्यारे दोस्तों हमें यह महसूस करने की जरूरत है कि एक पुरुष शारीरिक रूप से पुरुष और मानसिक रूप से महिला है और एक महिला मानसिक रूप से पुरुष और शारीरिक रूप से महिला है। हमें उनके दिमाग को वैज्ञानिक रूप से समझने की जरूरत है।	Non-anti-LGBT+ content	eng_hin
1287	हम होते कौन होते हैं मजहबी लोगों से भावनाओं की बात करने वाले.	Non-anti-LGBT+ content	eng_hin
1288	यार ऐसा बैंगन क्यों छोड़े जो दांत वाले मुंह को दांत रहित मुंह में चाहिए... उसे कल पोलू की जरूरत नहीं है, बैंगन ले आओ तो बाजार में बैंगन की कमी हो जाएगी... बैंगन वो अंदर गरम होगा...वे मसाला मिलाएंगे और परोसेंगे..सावधान रहें...	Non-anti-LGBT+ content	eng_hin
1289	तुझे देखकर मेरे रोंगटे खड़े हो जाते हैं	Non-anti-LGBT+ content	eng_hin
1290	हमें अब डरने की जरूरत नहीं है.... उनका पहनावा, अंदाज, भाषण इसी पर आधारित है...; हम अपने बच्चों को उनसे बचा सकते हैं....; बहुत स्पष्ट.. कि वे किसी बाहरी स्रोत से प्रभावित हैं....; समाज की जिम्मेदारी है कि वह इन लोगों से इसे बचाए...; समाज अपना कर्तव्य निभाएगा...	Homophobic	eng_hin
1291	बहुत परिपक्व वाक्पटुता	Non-anti-LGBT+ content	eng_hin
1292	आप बहुत खूबसूरत दिल_के_साथ_तीर दिल_के_साथ_तीर दिल_के_साथ_तीर मुंह मुंह हैं	Non-anti-LGBT+ content	eng_hin
1293	आप प्रकृति के विरुद्ध जो कुछ भी करते हैं, उसके परिणाम भयंकर होते हैं	Homophobic	eng_hin
1294	बड़ी से बड़ी बीमारी से मुक्ति	Non-anti-LGBT+ content	eng_hin
1295	वे एक मिश्रित जाति का भोजन क्यों हैं, मुझे नहीं पता कि प्यार कैसे आएगा और कब आएगा, लेकिन मुझे नहीं पता कि पहले कैसे संबंध बनाए जाते हैं। एक बार मैं प्रार्थना करने के बाद वेलंकन्नी गया और नागपट्टिनम जाने के लिए आया सलेम। फिर उन्होंने कहा कि बस रात के 4 बजे थी। बहुत हो गया। एक 65 वर्षीय व्यक्ति आया और मेरे बगल में लेट गया। उसने कहा कि वह नेवेली जाएगा। मैं ऐसे ही सो गया . अचानक, मैं एक एहसास के साथ जाग उठा। उस दिन, वह मेरे होठों को चूम रहा था और मुझे चूम रहा था। मुझे उस आराम की ज़रूरत थी। फिर उसने मुझे लेटा दिया और महसूस किया। यह एक तरह का आराम था। उस दिन से मुझे इसकी लत लग गई इसके लिए। उस दिन से, अगर मैं बूढ़े लोगों को देखता हूं, तो मैं उक्कम में जाकर सोऊंगा। मैं 46 साल का हूं।	Non-anti-LGBT+ content	eng_hin
1296	चिंता मत करो माँ .... तुम सब मेरी माँ हो .... मायूस_चेहरे_के_पसीने के साथ तुम्हारा सम्मान ... व्यक्ति_झुकना	Non-anti-LGBT+ content	eng_hin
1297	एक पुरुष के पास वह सब कुछ है जो वह एक महिला में चाहता है	Non-anti-LGBT+ content	eng_hin
1298	इस प्रकार की अराजकता तब तक जारी रहेगी जब तक भिखारी ट्रांसजेंडर समर्थक हैं। इन कुत्तों को बढ़ावा देने के लिए किसी को भुगतान न करें	Transphobic	eng_hin
1299	वैल्यू टैलेंट ... कृपया जेंडर पक्काथिगा ...	Non-anti-LGBT+ content	eng_hin
1300	मैं सभी से कुछ कहना चाहता हूं।	Non-anti-LGBT+ content	eng_hin
1301	चिंता मत करो माँ .... तुम सब मेरी माँ हो .... मायूस_चेहरे_के_पसीने के साथ तुम्हारा सम्मान ... व्यक्ति_झुकना	Non-anti-LGBT+ content	eng_hin
1302	हाथ जोड़कर	Non-anti-LGBT+ content	eng_hin
1303	राजकुमार सी	Non-anti-LGBT+ content	eng_hin
1304	इन कुत्तों को एनकाउंटर में डालो	Transphobic	eng_hin
1305	सब कुछ ठीक हो जाएगा। आप अपने परिवार के साथ अच्छे से रहें	Non-anti-LGBT+ content	eng_hin
1306	अपना हक़ मांग रहे हो तो इसमें गलत क्या है... प्यार तो किसी से भी हो सकता है...	Non-anti-LGBT+ content	eng_hin
1307	अगर केवल यह स्पष्टता सभी का समर्थन करेगी, महान और स्पष्ट उत्तर	Non-anti-LGBT+ content	eng_hin
1308	आपकी राय बहुत अच्छी है मेरे दोस्त ... लेकिन यह मत भूलो कि उनका अधिकार उनके हाथ में है ....	Non-anti-LGBT+ content	eng_hin
1309	योगेश वारन  हां.... हां... ठीक करो भाई यह सब कैसे मानव जाति को नष्ट कर रहा है... तो क्या यह एक दिन होगा... रुको और देखो..	Non-anti-LGBT+ content	eng_hin
1310	गोरे भी ऐसे नहीं होते...	Non-anti-LGBT+ content	eng_hin
1311	सरकार का खर्च उतना नहीं आता जितना पुरुष और महिला परिवारों पर खर्च होता है	Non-anti-LGBT+ content	eng_hin
