	text	category	ln
1955	सुपर एक्टिंग ओके_डंडू ओके_डंडू	Non-anti-LGBT+ content	eng_hin
1956	कौन है ये पागल	Non-anti-LGBT+ content	eng_hin
1957	यह दुनिया के सबसे अच्छे शब्दों में से एक है... ट्रांसजेंडर... लाल_दिल वो माँ के प्यार का पुनर्जन्म हैं... लाल_दिल लाल_दिल लाल_दिल स्नेह भी असीम है... लाल_दिल ... लाल दिल के	Non-anti-LGBT+ content	eng_hin
1958	डियर कैटरीना ये खूबसूरती, ये जॉब, ये दुनिया सब बदल जाती है, लेकिन एक जगह है जो नहीं बदलती जहां आपको कोई डिस्टर्ब न करे. यहां जैसा उतार-चढ़ाव नहीं है, वही स्वर्ग है।	Non-anti-LGBT+ content	eng_hin
1959	आपके और आपकी मांगों के साथ हुए अन्याय को संक्षेप में बताने के लिए अरुण अन्नान का बहुत-बहुत धन्यवाद...	Non-anti-LGBT+ content	eng_hin
1960	आशिक यहाँ क्या करे। गलता में नहीं	Non-anti-LGBT+ content	eng_hin
1961	एंकर आप तो टी शर्ट और जींस पहनते हो, पर संस्कार की बात करते हो, ये समय की बर्बादी है!!!	Non-anti-LGBT+ content	eng_hin
1962	अरे, मुझे नहीं पता कि तुम क्या पूछ रहे हो, मुझे नहीं पता कि वे बिना समझे क्यों जवाब दे रहे हैं	Non-anti-LGBT+ content	eng_hin
1963	वे प्रकृति का सम्मान नहीं करते...	Homophobic	eng_hin
1964	इस प्रकार की अश्लीलता, अभद्रता और उपद्रवी व्यवहार कुछ अच्छे ट्रांसजेंडरों की भी बदनामी का कारण बन रहा है जो एक गरिमापूर्ण जीवन जीने की कोशिश कर रहे हैं। इनमें से कुछ लोग जो अपने जन्म को बदसूरत और पतित स्त्रीत्व मानते हैं, ट्रांसजेंडर शब्द के लायक भी नहीं हैं। इसमें खराब अंबलों को साड़ी में बांधना, किन्नरों से झूठ बोलना और पैसे मांगना और उन्हें कोसना क्रूरता है। यह सब सम्मान या सम्मान के साथ जीवन जीने की इच्छा नहीं है। कुछ अच्छे ट्रांससेक्सुअल फंस गए हैं और उनका जीवन नरक बनता जा रहा है। लोगों को ऐसे लोगों की निंदा करनी चाहिए	Non-anti-LGBT+ content	eng_hin
1965	भाई, क्यों रो रहे हो और क्यों बिगड़ कर या चोरी करके परेशान हो, शरीर परिवर्तन के जिम्मेदार तुम नहीं हो।	Non-anti-LGBT+ content	eng_hin
1966	यदि संसार में ईश्वर है	Non-anti-LGBT+ content	eng_hin
1967	ट्रांसजेंडर एक देवी है	Non-anti-LGBT+ content	eng_hin
1968	100% सच आपने मानव समलैंगिक राक्षसों को सही कीमत दी है। वे जीने के लायक नहीं हैं। उन्हें इस अपमान के लिए फांसी दी जानी चाहिए।	Homophobic	eng_hin
1969	वह निःस्वार्थ प्रभु	Non-anti-LGBT+ content	eng_hin
1970	मुझसे यह परेशानी सहन नहीं हो रही है	Transphobic	eng_hin
1971	दोस्त आपकी एक्टिंग एक अलग लेवल पर है, कृपया कंचना मूवी भी देखें	Non-anti-LGBT+ content	eng_hin
1972	क्या कोई जानवर समलैंगिक हो सकता है?	Homophobic	eng_hin
1973	क्या मुझे व्हाट्सएप नंबर मिल सकता है?	Non-anti-LGBT+ content	eng_hin
1974	महिलाओं के अधिकारों की बात करने वाली द्रविड़ पार्टियों के लिए यह तोहफा है...	Non-anti-LGBT+ content	eng_hin
1975	लाउड_रोते_चेहरे पर आपका वीडियो कमाल है कि बहन वरदान है	Non-anti-LGBT+ content	eng_hin
1976	इतिहास अभी बाकी है..लोगों को लोगों से सेंस कहकर बांट रहा है..विश्व स्वास्थ्य संगठन जो कहता है उसे मैं क्यों मानूं..कैसे मान लूं कि यह सच है..पूर्वजों..इन जैसे मॉडल..आदमी खुद ..पैसे के लिए किया जा सकता है ..	Non-anti-LGBT+ content	eng_hin
1977	सामाजिक अव्यवस्था...	Homophobic	eng_hin
1978	मैं चेन्नई में एक समलैंगिक हूं, जिन लोगों से मैं अपने जीवन में मिला हूं, वे केवल सेक्स के लिए पूछ रहे हैं, लेकिन मुझे प्यार की जरूरत है रोना_चेहरा रोना_चेहरा रोना_चेहरा	Non-anti-LGBT+ content	eng_hin
1979	ईश्वर ने कुछ मनुष्यों के रूप में रूप धारण किया है	Non-anti-LGBT+ content	eng_hin
1980	मुर्दों में	Non-anti-LGBT+ content	eng_hin
1981	ध्यानमग्न_चेहरा	Non-anti-LGBT+ content	eng_hin
1982	प्रवीण कुमार कलियुग	Non-anti-LGBT+ content	eng_hin
1983	9:12 अंता मनसु था भगवान ने हाथ जोड़कर हाथ जोड़े	Non-anti-LGBT+ content	eng_hin
1984	4 घंटे में..1,25,999..लोगों ने देखा...21k लाइक्स.; क्या यह तमिल का विश्व रिकॉर्ड नहीं है? बधाई भाई; ; कहते हैं कि अच्छे दिल वाले हमेशा श्रेष्ठ होते हैं...; बस एक मिनट...इसके बारे में सोचो...भाई; सर्वशक्तिमान ईश्वर.. आपको अनंत स्वास्थ्य प्रदान करें..अमोघ जीवन...दीर्घ जीवन दें...	Non-anti-LGBT+ content	eng_hin
1985	अध्यक्ष महोदय, मुझे बताएं कि यह इरोड में कहां है	Non-anti-LGBT+ content	eng_hin
1986	उस ट्रांससेक्सुअल ने आपको जो दिया वह सच्चा प्यार था।	Non-anti-LGBT+ content	eng_hin
1987	चाहे कोई कुछ भी कहे। सुप्रीम कोर्ट ने जो दिया है, उसके बारे में बात करने का क्या मतलब है?	Non-anti-LGBT+ content	eng_hin
1988	अरवानिया के वेश में... बाय पास पोंगा.... देखते हैं कोई बुलाता है तो...	Non-anti-LGBT+ content	eng_hin
1989	इस वीडियो से पता चलता है कि उनमें भी एक बिंदास आत्मा है	Non-anti-LGBT+ content	eng_hin
1990	समलैंगिकता अप्राकृतिक है। यह गलत है। मैं इसे स्वीकार नहीं कर सकता।	Homophobic	eng_hin
1991	+ शक्ति विनयागम क्या आप जाकर इसे देखेंगे?	Non-anti-LGBT+ content	eng_hin
1992	कृपया ट्रांसजेंडरों और फ्रैंक चेयटू के अस्तित्व के लिए भीख न मांगें।	Non-anti-LGBT+ content	eng_hin
1993	ईश्वर की रचना में सभी को प्यार मिलता है... सिर्फ जताने का तरीका अलग होता है... सबको बराबर प्यार मिले तो सबको बराबर खुशी मिलती है... ऐसे में इस पोस्ट में उनके द्वारा शेयर किया गया प्यार खुशी के आंसू लाता है. मेरे दिल के अंदर...	Non-anti-LGBT+ content	eng_hin
1994	घायल मन को किसी को चोट पहुँचाए बिना अपने घावों को ठीक करने देने के लिए धन्यवाद	Non-anti-LGBT+ content	eng_hin
1995	तमिलों की नोक्कू वर्मा कला के बारे में पन्नुगा मदन वीडियो ....	Non-anti-LGBT+ content	eng_hin
1996	चंद्र लेखा	Transphobic	eng_hin
1997	आप इसके माध्यम से समाज को क्या कहना चाहते हैं? यह अच्छा नहीं है, लेकिन अगर हमारी इच्छा ऐसी है, तो यह सही है। सामाजिक अव्यवस्था। कृपया एक बात सोचें। इस तरह की तस्वीरें लेने और झंडे लगाने के बजाय, केवल अच्छी चीजें होनी चाहिए परवरिश।	Homophobic	eng_hin
1998	आप बहुत खूबसूरत हैं	Non-anti-LGBT+ content	eng_hin
1999	क्या इन शनि को नहीं होता कोरोना? जनता को चैन से रहने दो	Transphobic	eng_hin
2000	बोई मैरू बुडुंगु गुस्से में_चेहरे पर गुस्सा_चेहरे ऊँची एड़ी के जूते ऊँची एड़ी के जूते	Non-anti-LGBT+ content	eng_hin
2001	स्वभाव नहीं बदलना चाहिए।	Homophobic	eng_hin
2002	मैं श्रीलंका से हूँ। आपकी कहानियाँ बहुत रोचक हैं। मुझे समलैंगिकता में दिलचस्पी है और जब मैं आपका अनुभव सुनता हूं तो मुझे अपना अनुभव याद आता है। मैं आपसे श्रीलंका में मिलना चाहता हूं	Non-anti-LGBT+ content	eng_hin
2003	शानदार प्रदर्शन डे थम्बी	Non-anti-LGBT+ content	eng_hin
2004	स्पष्ट जवाब के साथ शानदार सवाल...समाज अपना रुख बदलेगा...इसे बस समय चाहिए	Non-anti-LGBT+ content	eng_hin
2005	बढ़िया वीडियो पोस्ट। सभी ट्रांसजेंडर प्यारी बहनें हैं	Non-anti-LGBT+ content	eng_hin
2006	सेक्स का अर्थ है प्रजनन	Homophobic	eng_hin
2007	ऐसा झूठ क्यों है.. क्या वो साड़ी कहीं दिखा सकते हैं.. पापी हो क्या?	Non-anti-LGBT+ content	eng_hin
2008	असली पोस्ट दोस्त	Non-anti-LGBT+ content	eng_hin
2009	यह मैराथन है। कुछ ट्रांससेक्सुअल आते हैं और अपराध करते हैं। मुझे नहीं पता कि पुलिस क्या कर रही है। मुझे नहीं पता कि हमारी सरकार क्या कार्रवाई करने जा रही है। वे बहुत आक्रामक हैं। इसके लिए एक अच्छा निर्णय होना चाहिए। वो कुछ नहीं कर सकते.मैं हर किसी को मुक्का नहीं मारना चाहता, लेकिन कुछ लोग आते हैं और बहुत अशिष्ट शब्द कहते हैं, वे अपने कपड़े उठाने के लिए बहुत मजबूत हैं, यकीन मानिए, आप उनके पास आ सकते हैं और लड़ सकते हैं.	Non-anti-LGBT+ content	eng_hin
2010	और हर बच्चा गर्भ में 4 हफ्ते तक लड़की होता है।	Non-anti-LGBT+ content	eng_hin
2011	ईश्वर ने 2 बनाया	Non-anti-LGBT+ content	eng_hin
2012	प्रजनन क्या आपका एक बच्चा नहीं है प्रजनन ज्यादा नहीं होता है प्रजनन मेंडेलियन पैटर्न नहीं बदलता है	Non-anti-LGBT+ content	eng_hin
2013	महोदय, एक सामाजिक कार्यकर्ता होने के नाते, आप कह रहे हैं कि व्यभिचार गलत नहीं है, इसमें एक बुद्धिमान व्यक्ति को भी रहने में क्या कठिनाई है, आप बात करें तो कोई बात नहीं, उसके लिए अपनी जिंदगी जीना जरूरी नहीं है। ज़िंदगी।	Non-anti-LGBT+ content	eng_hin
2014	जीवन्ति प्रियं हि	Non-anti-LGBT+ content	eng_hin
2015	खुश रहने के लिए खुले दिल से सीरियाई भीड़ का स्वागत करें...	Non-anti-LGBT+ content	eng_hin
2016	भनक के जादू की बात करें	Non-anti-LGBT+ content	eng_hin
2017	तमिल प्राचीन काल में, कई औद्योगिक तकनीकें थीं, उदाहरण के लिए, पेंट बनाने की तकनीक, इस तरह से बने पेंट्स का जीवन 1000 वर्ष से अधिक होगा। अगर उस उद्योग में तकनीक होती तो हमारा देश दुनिया में अव्वल होता। ऐसी अप्रचलित तकनीकों का रिकॉर्ड बनाएं।	Non-anti-LGBT+ content	eng_hin
2018	बीएसएम  क्या आपकी सगाई तब होगी जब आपके पति बच्चों से दूर हों लेकिन उन्हें अभी तक साथी नहीं मिला हो। इसे अजमाएं। लेकिन भारतीय महिलाओं को इससे सहमत होना मुश्किल लगता है।	Homophobic	eng_hin
2019	मदन दुनिया को गुलाम बनाने और दबाने वाली ब्रिटिश सेना के बारे में एक वीडियो शेयर करें मदन......	Non-anti-LGBT+ content	eng_hin
2020	नसामा नाश का अंतिम उपाय है। यह ईश्वर का सबसे बड़ा पाप है। इस प्रकार परमेश्वर ने सदोम और अमोरा को सदोम और अमोरा की भूमि के साथ मिट्टी में मिला दिया। चलो इसे कानूनी रूप से गलत कहते हैं ताकि हमें फिर से कोरोना जैसा परिणाम न मिले। सदोम और अमोरा के विनाश का प्रमाण पृथ्वी पर है।	Homophobic	eng_hin
2021	हो सके तो मैं तुमसे कह रहा हूँ कि बहन 100 साल धड़क-धड़क कर जी ले	Non-anti-LGBT+ content	eng_hin
2022	धूर्त केक  वे क्या कर रहे हैं बदसूरत.....कृपया	Non-anti-LGBT+ content	eng_hin
2023	मैं आपको, दोस्तों, भूखे को भोजन कराने के आपके अच्छे विचारों के लिए सलाम करता हूं	Non-anti-LGBT+ content	eng_hin
2024	सांस्कृतिक क्षय होगा… कम से कम तमिलनाडु में…।	Non-anti-LGBT+ content	eng_hin
2025	कुलदीप एमवी पूछने का एक तरीका है। यह कहने जैसा है। यदि आप सही बोलते हैं। वह भगवान देख रहा है। जल्द ही। आपके परिवार में। एक सुंदर, ट्रांससेक्सुअल। निश्चित रूप से स्वीकार करेगा। यह। कुथंडावर मिठू। शांति डॉ	Non-anti-LGBT+ content	eng_hin
2026	सूर्या मूर्ति प्रिय मित्र, हम अपने मित्रों से सभी प्रकार के सुख प्राप्त कर सकते हैं। यह हमारी पत्नी से संभव नहीं है। केवल हमारे प्रिय मित्र ही हमारी भावनाओं को समझ सकते हैं और हमारी भावनाओं को साझा कर सकते हैं। हम उनके साथ अपने पसंदीदा सेक्स का पूरा आनंद ले सकते हैं। धन्यवाद मित्र।	Non-anti-LGBT+ content	eng_hin
2027	तुझे देखकर मेरे रोंगटे खड़े हो जाते हैं	Non-anti-LGBT+ content	eng_hin
2028	चंद्रलेखा  अटिंगा बोडी वन्स 9 !!!	Transphobic	eng_hin
2029	मुस्लिम महिला ने कहा..100% सही	Non-anti-LGBT+ content	eng_hin
2030	आपके इस अनूठे प्रयास के लिए मैं हृदय से नमन करता हूँ। वह बहन भगवान के ट्रांसजेंडर अवतारों का आदर्श उदाहरण है।	Non-anti-LGBT+ content	eng_hin
2031	हाय दीदी, मैं प्रिया हूं, मैं ट्रांससेक्सुअल के बारे में एक किताब से सबक सीखना चाहती हूं, तो वे ऐसी हरकत नहीं करेंगे जैसे उन्हें छोटी उम्र से चोट लगी हो। मेरी मेल आईडी manimani85032gmail। कॉम pls मुझसे संपर्क करें	Non-anti-LGBT+ content	eng_hin
2032	अपनी आँखें बंद रखो मेरे दोस्त	Non-anti-LGBT+ content	eng_hin
2033	face_screaming_in_fear face_screaming_in_dear face_screaming_in_fear कह नहीं सकता कि ऐसा नहीं होगा...	Homophobic	eng_hin
2034	मैं सभी प्रत्याशियों से विनम्र निवेदन करता हूं कि मुरुसू चुनाव चिह्न पर वोट करें, कैप्टन विजयकांत, तमिलनाडु के शेर, कैप्टन राधा विश्वासी, हाथ जोड़कर, हाथ जोड़कर, हाथ जोड़कर	Non-anti-LGBT+ content	eng_hin
2035	अगर आप में से कोई खाना बनाना जानता है, तो मुझे बताएं कि मैं उसे नौकरी दूंगा। मैं भौंकने वाले 3 लोगों को काम दे सकता हूं। कार्य स्थल पुडुचेरी (तालाब)।	Non-anti-LGBT+ content	eng_hin
2036	नसामा नाश का अंतिम उपाय है। यह ईश्वर का सबसे बड़ा पाप है। इस प्रकार परमेश्वर ने सदोम और अमोरा को सदोम और अमोरा की भूमि के साथ मिट्टी में मिला दिया। चलो इसे कानूनी तौर पर गलत बताते हैं ताकि फिर से कोरोना जैसी तबाही ना हो। सदोम और अमोरा के विनाश का प्रमाण पृथ्वी पर है।	Homophobic	eng_hin
2037	महान स्पष्टीकरण। एक बुद्धिमान व्यक्ति समझेगा। एक पागल व्यक्ति मुझे भी डाँटेगा	Non-anti-LGBT+ content	eng_hin
2038	आपने इस वीडियो को बिना समझे त्रिची बस स्टैंड से लिया है और इसे ट्रांसजेंडर लोगों पर पोस्ट कर दिया है, अगर आप इस वीडियो को नहीं हटाते हैं, तो कानून बहुत जल्द आप पर गिरेगा, चाहे वह पुरुष हो या महिला।	Non-anti-LGBT+ content	eng_hin
2039	भाई आप एक सुंदर साक्षात्कार कर रहे हैं आप बहुत प्यार करते हैं भाई	Non-anti-LGBT+ content	eng_hin
2040	इस फिल्म के माध्यम से जिन बच्चों को बताया जाता है कि उनका बेटा ट्रांसजेंडर है उनकी कठिनाइयों को खूबसूरती से दर्शाया गया है। इस फिल्म में सभी कलाकारों ने बेहतरीन अभिनय किया है। मां और बेटे के रिश्ते को भी खूबसूरती से बयां किया गया है।	Non-anti-LGBT+ content	eng_hin
2041	ये एहसास है कि कामत में भी प्यार है.. उस एहसास की कद्र करो और जिंदगी तुम्हारे हाथ में है..	Non-anti-LGBT+ content	eng_hin
2042	इसमें ट्रांससेक्सुअल की प्रगति देखी जा सकती है.... प्रगति को प्रगति के रूप में पास करते हुए, हम पुरुषों से पीछे रह जाते हैं	Transphobic	eng_hin
2043	भारतीय संघ अब धीरे-धीरे मर जाएगा।	Non-anti-LGBT+ content	eng_hin
2044	जहाँ तक मैं जानता हूँ, जो दूसरों की भावनाओं का आदर करते हैं, वे सर्वश्रेष्ठ हैं	Non-anti-LGBT+ content	eng_hin
2045	भिखारियों को उठाकर बातें कर रहे हैं, क्या रेलवे पुलिस सो रही है, लोग, मजाक मत करो, हमें क्या हुआ है, कल आपके साथ ऐसा हो सकता है।	Non-anti-LGBT+ content	eng_hin
