	text	category	ln
1990	സ്വവർഗരതി പ്രകൃതിവിരുദ്ധമാണ്.അത് തെറ്റാണ്.എനിക്കത് അംഗീകരിക്കാൻ കഴിയില്ല.	Homophobic	eng_ml
1991	+Sakthi Vinayagam നിങ്ങൾ പോയി കാണുമോ?	Non-anti-LGBT+ content	eng_ml
1992	ട്രാൻസ്‌ജെൻഡേഴ്സിന്റെയും ഫ്രാങ്ക് ചെയ്‌തുവിന്റെയും നിലനിൽപ്പിനായി ദയവായി യാചിക്കരുത്.	Non-anti-LGBT+ content	eng_ml
1993	ദൈവത്തിന്റെ സൃഷ്ടിയിൽ എല്ലാവരും സ്നേഹിക്കപ്പെടുന്നു...അത് പ്രകടിപ്പിക്കുന്ന രീതി മാത്രം വ്യത്യസ്തമാണ്...എല്ലാവർക്കും തുല്യമായ സ്നേഹം ലഭിച്ചാൽ എല്ലാവർക്കും തുല്യമായ സന്തോഷമാണ് ലഭിക്കുന്നത്...അങ്ങനെ ഈ പോസ്റ്റിൽ അദ്ദേഹം പങ്കുവെച്ച സ്നേഹം സന്തോഷത്തിന്റെ കണ്ണീരൊപ്പുന്നു. എന്റെ ഹൃദയത്തിനുള്ളിൽ...	Non-anti-LGBT+ content	eng_ml
1994	മുറിവേറ്റ മനസ്സിനെ ആരെയും വേദനിപ്പിക്കാതെ മുറിവുണക്കാൻ അനുവദിച്ചതിന് നന്ദി	Non-anti-LGBT+ content	eng_ml
1995	തമിഴരുടെ നോക്കു വർമ്മ കലയെ കുറിച്ചുള്ള പന്നുഗ മദൻ വീഡിയോ....	Non-anti-LGBT+ content	eng_ml
1996	ചന്ദ്രലേഖ	Transphobic	eng_ml
1997	ഇതിലൂടെ സമൂഹത്തോട് എന്താണ് പറയാനുള്ളത് ?അത് നല്ലതല്ല , പക്ഷെ നമ്മുടെ ആഗ്രഹം അങ്ങനെയാണെങ്കിൽ അത് ശരിയാണ് .സാമൂഹിക വിഭ്രാന്തി .. ഒന്ന് ആലോചിച്ചു നോക്കൂ .. ഇങ്ങനെ പടമെടുക്കുന്നതിനും കൊടികുത്തുന്നതിനും പകരം നല്ലത് മാത്രം ആകണം കൊണ്ടുവന്നു.	Homophobic	eng_ml
1998	നിങ്ങൾ വളരെ മനോഹരിയാണ്	Non-anti-LGBT+ content	eng_ml
1999	ഈ ശനികൾക്ക് കൊറോണ പിടിപെടില്ലേ? പൊതുജനം സമാധാനത്തോടെ വിശ്രമിക്കട്ടെ	Transphobic	eng_ml
2000	Boi Mairu Budungu angry_face angry_face high-heeled_shoe ഹൈ-ഹീൽ_ഷൂ	Non-anti-LGBT+ content	eng_ml
2001	പ്രകൃതി മാറ്റാൻ പാടില്ല.	Homophobic	eng_ml
2002	ഞാൻ ശ്രീലങ്കയിൽ നിന്നാണ്. നിങ്ങളുടെ കഥകൾ വളരെ രസകരമാണ്. എനിക്ക് സ്വവർഗരതിയിൽ താൽപ്പര്യമുണ്ട്, നിങ്ങളുടേത് കേൾക്കുമ്പോൾ എന്റെ അനുഭവം ഓർക്കുന്നു. എനിക്ക് നിങ്ങളെ ശ്രീലങ്കയിൽ വച്ച് കാണണം	Non-anti-LGBT+ content	eng_ml
2003	ദേ തമ്പി ഗംഭീര പ്രകടനം	Non-anti-LGBT+ content	eng_ml
2004	വ്യക്തമായ ഉത്തരങ്ങളുള്ള മഹത്തായ ചോദ്യങ്ങൾ...സമൂഹം നിലപാട് മാറ്റും... അതിന് സമയം മതി	Non-anti-LGBT+ content	eng_ml
2005	നല്ല വീഡിയോ പോസ്റ്റ്. എല്ലാ ട്രാൻസ്‌ജെൻഡറുകളും പ്രിയ സഹോദരിമാരാണ്	Non-anti-LGBT+ content	eng_ml
2006	ലൈംഗികത എന്നാൽ പ്രത്യുൽപാദനം എന്നാണ് അർത്ഥമാക്കുന്നത്	Homophobic	eng_ml
2007	എന്തിനാ ഇങ്ങനെ ഒരു നുണ പറയുന്നത്.. അവർക്ക് സാരി എവിടെയെങ്കിലും കാണിക്കാമോ.. നിങ്ങൾ പാപികളാണോ?	Non-anti-LGBT+ content	eng_ml
2008	യഥാർത്ഥ പോസ്റ്റ് സുഹൃത്തേ	Non-anti-LGBT+ content	eng_ml
2009	ഇത് മാരത്തൺ ആണ്.. ചില ട്രാൻസ്സെക്ഷ്വൽസ് വന്ന് കുറ്റകൃത്യങ്ങൾ ചെയ്യുന്നു.. പോലീസ് എന്താണ് ചെയ്യുന്നതെന്ന് എനിക്കറിയില്ല.. എന്ത് നടപടിയാണ് നമ്മുടെ സർക്കാർ എടുക്കാൻ പോകുന്നതെന്ന് എനിക്കറിയില്ല. അവർ വളരെ അക്രമാസക്തരാണ്.. ഇതിനൊരു നല്ല വിധി ഉണ്ടാകണം. അവർക്ക് ഒന്നും ചെയ്യാൻ കഴിയില്ല, എല്ലാവരേയും പഞ്ച് ചെയ്യാൻ ഞാൻ ആഗ്രഹിക്കുന്നില്ല, പക്ഷേ ചിലർ വന്ന് വളരെ മോശമായ വാക്കുകൾ പറയുന്നു, വസ്ത്രം ഉയർത്താൻ അവർ ശക്തരാണ്, വിശ്വസിക്കൂ, നിങ്ങൾക്ക് അവരുടെ അടുത്ത് വന്ന് വഴക്കിടാം.	Non-anti-LGBT+ content	eng_ml
2010	ഗർഭപാത്രത്തിൽ 4 ആഴ്ച വരെ ഓരോ കുഞ്ഞും ഒരു പെൺകുട്ടിയാണ്.	Non-anti-LGBT+ content	eng_ml
2011	ദൈവം സൃഷ്ടിച്ചത് 2	Non-anti-LGBT+ content	eng_ml
2012	പുനരുൽപ്പാദനം നിങ്ങൾക്ക് ഒരു കുട്ടി ഇല്ലേ, പ്രത്യുൽപാദനം വളരെയധികം സംഭവിക്കുന്നില്ല, പ്രത്യുൽപാദനം മെൻഡലിയൻ പാറ്റേണിനെ മാറ്റില്ല	Non-anti-LGBT+ content	eng_ml
2013	സാർ സാമൂഹ്യ പ്രവർത്തകനായ താങ്കൾ പറയുന്നത് വ്യഭിചാരം തെറ്റല്ല എന്നാണല്ലോ, ബുദ്ധിയുള്ള ഒരാൾക്ക് പോലും ഇതിൽ ജീവിക്കാൻ എന്താണ് ബുദ്ധിമുട്ട്?അതിനെ കുറിച്ച് പറഞ്ഞിട്ട് കാര്യമില്ല, അവൻ ജീവിക്കുകയല്ല വേണ്ടത്. ജീവിതം.	Non-anti-LGBT+ content	eng_ml
2014	ജീവനതി പ്രിയൻ ഹായ്	Non-anti-LGBT+ content	eng_ml
2015	സന്തോഷമായിരിക്കാൻ ഒരു സിറിയൻ ജനക്കൂട്ടത്തെ ഹൃദയം തുറന്ന് സ്വാഗതം ചെയ്യാം....	Non-anti-LGBT+ content	eng_ml
2016	മഷിയുടെ മാന്ത്രികതയെക്കുറിച്ച് സംസാരിക്കുക	Non-anti-LGBT+ content	eng_ml
2017	തമിഴ് പുരാതന കാലത്ത്, നിരവധി വ്യാവസായിക സാങ്കേതിക വിദ്യകൾ ഉണ്ടായിരുന്നു, ഉദാഹരണത്തിന്, പെയിന്റുകൾ നിർമ്മിക്കുന്നതിനുള്ള സാങ്കേതികത, അങ്ങനെ നിർമ്മിച്ച പെയിന്റുകളുടെ ആയുസ്സ് 1000 വർഷം കവിയുന്നു. ആ വ്യവസായത്തിൽ സാങ്കേതിക വിദ്യകൾ ഉണ്ടായിരുന്നെങ്കിൽ നമ്മുടെ രാജ്യം ലോകത്തിൽ തന്നെ ഒന്നാമതായിരുന്നേനെ. അത്തരം കാലഹരണപ്പെട്ട സാങ്കേതികവിദ്യകളുടെ റെക്കോർഡ് ഉണ്ടാക്കുക.	Non-anti-LGBT+ content	eng_ml
2018	BSM  നിങ്ങളുടെ ഭർത്താവ് കുട്ടികളുമായി അകന്നിരിക്കുമ്പോൾ നിങ്ങൾ വിവാഹനിശ്ചയം നടത്തുമോ, എന്നാൽ ഇതുവരെ ഒരു പങ്കാളിയെ കണ്ടെത്താനായിട്ടില്ല. പരീക്ഷിച്ചു നോക്കൂ. എന്നാൽ ഇന്ത്യൻ സ്ത്രീകൾക്ക് സമ്മതിക്കാൻ പ്രയാസമാണ്.	Homophobic	eng_ml
2019	മദൻ ലോകത്തെ അടിമകളാക്കി അടിച്ചമർത്തുന്ന ബ്രിട്ടീഷ് സേനയെക്കുറിച്ചുള്ള ഒരു വീഡിയോ ഷെയർ ചെയ്യുക മദൻ.......	Non-anti-LGBT+ content	eng_ml
2020	നശിക്കാനുള്ള പരമമായ മാർഗമാണ് നസാമ. അത് ദൈവത്തിന്റെ ഏറ്റവും വലിയ പാപമാണ്. അങ്ങനെയാണ് ദൈവം സോദോമിനെയും ഗൊമോറയെയും സോദോമിന്റെയും ഗൊമോറയുടെയും മണ്ണിൽ പൊടിയാക്കിയത്. കൊറോണ പോലൊരു ഫലം ഇനി വരാതിരിക്കാൻ നമുക്ക് ഇതിനെ നിയമപരമായി തെറ്റ് എന്ന് വിളിക്കാം. സോദോമിന്റെയും ഗൊമോറയുടെയും നാശത്തിന്റെ തെളിവുകൾ ഭൂമിയിലുണ്ട്.	Homophobic	eng_ml
2021	കഴിയുമെങ്കിൽ ഞാൻ നിങ്ങളോട് പറയുന്നു, ആ സഹോദരി 100 വർഷം ജീവിക്കണം.	Non-anti-LGBT+ content	eng_ml
2022	ക്രാഫ്റ്റ് കേക്ക്  അവർ എന്താണ് വൃത്തികെട്ടത് ചെയ്യുന്നത്.....ദയവായി	Non-anti-LGBT+ content	eng_ml
2023	സുഹൃത്തുക്കളേ, വിശക്കുന്നവർക്ക് ഭക്ഷണം നൽകാനുള്ള നിങ്ങളുടെ നല്ല ചിന്തകൾക്ക് ഞാൻ നിങ്ങളെ അഭിവാദ്യം ചെയ്യുന്നു	Non-anti-LGBT+ content	eng_ml
2024	തമിഴ്നാട്ടിലെങ്കിലും സാംസ്കാരിക അപചയം ഉണ്ടാകും.	Non-anti-LGBT+ content	eng_ml
2025	kuladeep mv  ചോദിക്കാൻ ഒരു വഴിയുണ്ട്.അത് പറയുന്നത് പോലെയാണ്, നിങ്ങൾ ശരിയായി പറഞ്ഞാൽ, ആ ദൈവം.. ഉടൻ തന്നെ.. നിങ്ങളുടെ കുടുംബത്തിൽ, ഒരു സുന്ദരിയായ, ട്രാൻസ്സെക്ഷ്വൽ.. തീർച്ചയായും അംഗീകരിക്കും.. ഇത്.. കുത്താണ്ടവർ മിഥു. സമാധാനം ഡോ	Non-anti-LGBT+ content	eng_ml
2026	സൂര്യമൂർത്തി  പ്രിയ സുഹൃത്തേ, നമുക്ക് നമ്മുടെ സുഹൃത്തുക്കളിൽ നിന്ന് എല്ലാവിധ സന്തോഷങ്ങളും ആസ്വദിക്കാം.നമ്മുടെ ഭാര്യയിൽ നിന്ന് അത് സാധ്യമല്ല.നമ്മുടെ പ്രിയ സുഹൃത്തുക്കൾക്ക് മാത്രമേ നമ്മുടെ വികാരങ്ങൾ മനസ്സിലാക്കാനും നമ്മുടെ വികാരങ്ങൾ പങ്കുവെക്കാനും കഴിയൂ. അവരുമായി നമ്മുടെ പ്രിയപ്പെട്ട ലൈംഗികത പൂർണ്ണമായും ആസ്വദിക്കാം. നന്ദി സുഹൃത്തേ.	Non-anti-LGBT+ content	eng_ml
2027	നിന്നെ കാണുമ്പോൾ എനിക്ക് വിറയൽ വരുന്നു	Non-anti-LGBT+ content	eng_ml
2028	ചന്ദ്രലേഖ  അതിങ്ക ബോഡി ഒരിക്കൽ 9 !!!	Transphobic	eng_ml
2029	മുസ്ലീം സ്ത്രീ പറഞ്ഞത് 100% ശരിയാണ്	Non-anti-LGBT+ content	eng_ml
2030	നിങ്ങളുടെ അതുല്യമായ പരിശ്രമത്തിന് എന്റെ ആത്മാർത്ഥമായ അഭിനന്ദനം. ദൈവത്തിന്റെ ട്രാൻസ്‌ജെൻഡർ അവതാരങ്ങളുടെ ഉത്തമ ഉദാഹരണമാണ് ആ സഹോദരി.	Non-anti-LGBT+ content	eng_ml
2031	ഹായ് സഹോദരി, ഞാൻ പ്രിയയാണ്, ട്രാൻസ്‌സെക്ഷ്വലുകളെക്കുറിച്ചുള്ള ഒരു പുസ്തകത്തിൽ നിന്ന് എനിക്ക് ഒരു പാഠം പഠിക്കണം, അപ്പോൾ അവർ ചെറുപ്പം മുതലേ വേദനിപ്പിക്കുന്നത് പോലെ പ്രവർത്തിക്കില്ല.എന്റെ മെയിൽ ഐഡി manimani85032gmail. കോം ദയവായി എന്നെ ബന്ധപ്പെടുക	Non-anti-LGBT+ content	eng_ml
2032	കണ്ണടച്ചിരിക്കൂ സുഹൃത്തേ	Non-anti-LGBT+ content	eng_ml
2033	ഭയം_ഭയത്തിൽ_മുഖം_ആക്രോശം_ഭയത്തിൽ_അലറുന്നു അത് നടക്കില്ലെന്ന് പറയാനാവില്ല...	Homophobic	eng_ml
2034	എല്ലാ സ്ഥാനാർത്ഥികളും മുരുശു ചിഹ്നത്തിൽ വോട്ട് ചെയ്യണമെന്ന് വിനീതമായി അഭ്യർത്ഥിക്കുന്നു, തമിഴ്നാടിന്റെ സിംഹം ക്യാപ്റ്റൻ വിജയകാന്ത്, ക്യാപ്റ്റൻ രാധാ വിശ്വാസി കൈകൾ കൂപ്പി_കൈകൾ	Non-anti-LGBT+ content	eng_ml
2035	നിങ്ങളിൽ ആർക്കെങ്കിലും പാചകം അറിയാമെങ്കിൽ പറയൂ ഞാൻ അവർക്ക് ഒരു ജോലി തരാം. കുരയ്ക്കുന്ന 3 പേർക്ക് ഞാൻ പണി കൊടുക്കാം. ജോലി സ്ഥലം പുതുച്ചേരി (കുളം).	Non-anti-LGBT+ content	eng_ml
2036	നശിക്കാനുള്ള പരമമായ മാർഗമാണ് നസാമ. അത് ദൈവത്തിന്റെ ഏറ്റവും വലിയ പാപമാണ്. അങ്ങനെയാണ് ദൈവം സോദോമിനെയും ഗൊമോറയെയും സോദോമിന്റെയും ഗൊമോറയുടെയും മണ്ണിൽ പൊടിയാക്കിയത്. ഇനി കൊറോണ പോലൊരു നാശം ഉണ്ടാകാതിരിക്കാൻ അതിനെ നിയമപരമായി തെറ്റ് എന്ന് വിളിക്കാം. സോദോമിന്റെയും ഗൊമോറയുടെയും നാശത്തിന്റെ തെളിവുകൾ ഭൂമിയിലുണ്ട്.	Homophobic	eng_ml
2037	മഹത്തായ വിശദീകരണം.ബുദ്ധിയുള്ളവൻ മനസ്സിലാക്കും.ഭ്രാന്തൻ എന്നെയും ശകാരിക്കും	Non-anti-LGBT+ content	eng_ml
2038	നിങ്ങൾ ഇത് മനസ്സിലാക്കാതെ ട്രിച്ചി ബസ് സ്റ്റാൻഡിൽ നിന്ന് ഈ വീഡിയോ എടുത്ത് ട്രാൻസ്ജെൻഡേഴ്സിൽ പോസ്റ്റ് ചെയ്തു, ഈ വീഡിയോ നീക്കം ചെയ്തില്ലെങ്കിൽ, അത് ആണായാലും പെണ്ണായാലും നിങ്ങളുടെ മേൽ നിയമം ഉടൻ വീഴും.	Non-anti-LGBT+ content	eng_ml
2039	ബ്രോ നിങ്ങൾ ഒരു മനോഹരമായ ഇന്റർവ്യൂ നടത്തുകയാണ് ബ്രോ.	Non-anti-LGBT+ content	eng_ml
2040	മകൻ ട്രാൻസ്‌ജെൻഡറാണെന്ന് പറയുന്ന മക്കളുടെ കഷ്ടപ്പാടുകൾ ഈ ചിത്രത്തിലൂടെ മനോഹരമായി ചിത്രീകരിച്ചിരിക്കുന്നു.ഈ ചിത്രത്തിലെ എല്ലാ അഭിനേതാക്കളും മനോഹരമായി അഭിനയിച്ചിട്ടുണ്ട്.അമ്മയും മകനും തമ്മിലുള്ള ബന്ധവും മനോഹരമായി പറഞ്ഞിട്ടുണ്ട്.	Non-anti-LGBT+ content	eng_ml
2041	കാമത്തിനും സ്നേഹമുണ്ടെന്ന തോന്നൽ.. ആ വികാരത്തെ വിലമതിക്കുക, നിങ്ങളുടെ ജീവിതം നിങ്ങളുടെ കൈകളിലാണ്..	Non-anti-LGBT+ content	eng_ml
2042	ട്രാൻസ്‌സെക്ഷ്വലുകളുടെ പുരോഗതി ഇതിൽ കാണാം.... പുരോഗതിയെ പുരോഗമനമെന്ന നിലയിൽ കടത്തിവിട്ട്, പുരുഷന്മാർ ഉച്ചത്തിൽ_കരയുന്ന_മുഖം ഉച്ചത്തിൽ_കരയുന്ന_മുഖം ഉച്ചത്തിൽ_കരയുന്ന_മുഖം	Transphobic	eng_ml
2043	ഇന്ത്യൻ യൂണിയൻ ഇപ്പോൾ പതുക്കെ മരിക്കും.	Non-anti-LGBT+ content	eng_ml
2044	എനിക്കറിയാവുന്നിടത്തോളം മറ്റുള്ളവരുടെ വികാരങ്ങളെ മാനിക്കുന്നവരാണ് ഏറ്റവും മികച്ചത്	Non-anti-LGBT+ content	eng_ml
2045	യാചകരെ കൂട്ടിക്കൊണ്ടുപോയി സംസാരിക്കുന്നു, റെയിൽവേ പോലീസ് ഉറങ്ങുകയാണോ, ആളുകളേ, തമാശ പറയരുത്, ഞങ്ങൾക്ക് എന്താണ് പറ്റിയത്, നാളെ നിങ്ങൾക്കും ഇത് സംഭവിച്ചേക്കാം.	Non-anti-LGBT+ content	eng_ml
2046	ഈ അനീതി ഒരു വ്യക്തിയുടെ മനുഷ്യാവകാശമാണെങ്കിൽ. ഹെറോയിൻ, മരിജുവാന, മറ്റ് എല്ലാ ലഹരിവസ്തുക്കളും കൈവശം വയ്ക്കുന്നത് ഒരു വ്യക്തിഗത മനുഷ്യാവകാശമാണ്	Homophobic	eng_ml
2047	മികച്ചതും മികച്ചതുമായ ഡാറ്റ, സർക്കാർ അവർക്ക് ഉപജീവനമാർഗം നൽകണം, അവർ മനുഷ്യരാണ്	Non-anti-LGBT+ content	eng_ml
2048	അത് വിദേശ ഗൂഢാലോചനയാണ്. എക്കാലത്തെയും മോശമായ ആക്രമണമാണിത്. സ്ത്രീകൾ എങ്ങനെയാണ് ഇതിനെ പിന്തുണയ്ക്കുന്നതെന്ന് എനിക്ക് മനസ്സിലാകുന്നില്ല. ഒരു കമ്പ്യൂട്ടർ കമ്പനിയിൽ പഠിക്കുകയും ജോലി ചെയ്യുകയും ചെയ്യുന്ന സ്ത്രീകൾക്കും പുരുഷന്മാർക്കും മാത്രമേ പിന്തുണയുള്ളൂ. ഇവരെല്ലാം പണത്തിനു വേണ്ടി വിദേശ സംസ്കാരത്തിന്റെ അടിമകളാണ്.	Homophobic	eng_ml
2049	എന്തുകൊണ്ടാണ് നിങ്ങൾ ലോറസ് എന്ന് പറയുന്നത്?	Non-anti-LGBT+ content	eng_ml
2050	മുഖം_കണ്ണുനീർ_നിറഞ്ഞ_മുഖം_കണ്ണുനീരോടെ_ആനന്ദം	Non-anti-LGBT+ content	eng_ml
2051	മറ്റുള്ളവരുടെ മനസ്സമാധാനത്തിനായി സ്വന്തം ജീവനെടുക്കാൻ തയ്യാറുള്ള ഒരു ജീവിവർഗമാണ് ട്രാൻസ്‌ജെൻഡറുകൾ.	Non-anti-LGBT+ content	eng_ml
2052	ബെനാദം പ്രദേശം?	Non-anti-LGBT+ content	eng_ml
2053	എങ്ങനെയൊക്കെയോ ഇവിടെ എല്ലാരും ഉത്തമനെപ്പോലെയാണ്, നാണക്കേടായി	Non-anti-LGBT+ content	eng_ml
2054	ഇതുവരെ 13 ഡിസ്‌ലൈക്കുകൾ മാത്രം, എന്നാൽ 230 ലൈക്കുകൾ; ; താങ്കൾ പറയാൻ വന്നതിന്റെ ഏറ്റവും വലിയ വിജയമായി ഞാൻ ഇതിനെ കരുതുന്നു.	Non-anti-LGBT+ content	eng_ml
2055	നീ നിന്റെ അവകാശം ചോദിച്ചാൽ ഇതിലെന്താ കുഴപ്പം... സ്നേഹം ആർക്കും വരാം...	Non-anti-LGBT+ content	eng_ml
2056	നാഗ രത്നം ; ഭിക്ഷാടനത്തിനല്ല, യാത്ര ചെയ്യാനാണ് ട്രെയിൻ ഓടുന്നത്.	Non-anti-LGBT+ content	eng_ml
2057	എടുത്ത് യാചിക്കുക. ഇതൊരു വലിയ നായയാണ്	Non-anti-LGBT+ content	eng_ml
2058	ആ ട്രാൻസ്‌ജെൻഡർ അമ്മ കരയുന്ന_മുഖം മടക്കി_കൈകൾ മടക്കി_കൈകൾ മടക്കി_കൈകൾ മടക്കി_കൈകൾ കെട്ടിയതിനെ ഞാൻ ആരാധിക്കുന്നു	Non-anti-LGBT+ content	eng_ml
2059	മനുഷ്യൻ മാത്രമാണ് പരിഹാരം..	Non-anti-LGBT+ content	eng_ml
2060	ആ മനസ്സാണ് ദൈവം സ്ഥിരതയുള്ള_മുഖം സ്ഥിരതയുള്ള_മുഖം സ്ഥിരതയുള്ള_മുഖം സ്ഥിരതയുള്ള_മുഖം	Non-anti-LGBT+ content	eng_ml
2061	നിങ്ങൾ ട്രാൻസ്‌ജെൻഡറാണെന്ന് സ്വയം വഞ്ചിക്കുന്നതെന്തിന്? നിങ്ങൾ ഒരു ട്രാൻസ്‌സെക്ഷ്വൽ അല്ല, ഒരു സാധാരണ മനുഷ്യനാണെന്ന് അറിയുമ്പോൾ ആ ട്രാൻസ്‌ജെൻഡർ എങ്ങനെയായിരിക്കുമെന്ന് നിങ്ങൾക്ക് ഊഹിക്കാൻ കഴിയുന്നില്ലേ? ജോലിയുമായി പോകുന്ന ട്രാൻസ്‌ജെൻഡറിനോട് എന്തിനാണ് ഇങ്ങനെ ചെയ്യുന്നത്? ഇത് കണ്ട് ഞങ്ങൾ ചിരിക്കില്ല. ഇതിന്റെ രണ്ടാം ഭാഗം രസകരമല്ലാത്ത മറ്റൊരു_മുഖമാണ്	Non-anti-LGBT+ content	eng_ml
2062	സഹായിക്കുക എന്നത് ഒരു നല്ല പരിശീലനമാണ്, അഭിനന്ദനങ്ങൾ	Non-anti-LGBT+ content	eng_ml
2063	നമുക്കത് വാങ്ങാം	Non-anti-LGBT+ content	eng_ml
2064	വീഡിയോ മുഴുവനായി ഇടുക, പകുതിയായി മുറിക്കുക, നിങ്ങൾക്ക് പണം സമ്പാദിക്കാം.	Non-anti-LGBT+ content	eng_ml
