	text	category	ln
674	INDHA 20% LA ലെസ്പിയൻസ് EVLO ശതമാനം ബ്രോ?(ഇന്ത്യ-LA).....; പുരുഷൻ ഉണർവിന്റെ രൂപമാണ്....സ്ത്രീയാണ് താങ്ങുകാരി...(ഭൂമി പോലെ....ഖബറിനെ താങ്ങുന്ന ഭൂമി...)....ക്ഷമയും സമാധാനവും ശാന്തതയും....ശരീരം അങ്ങനെയാണ് രൂപകൽപന ചെയ്തിരിക്കുന്നത്. മനുഷ്യൻ... അത് മൃഗമായാലും മനുഷ്യനായാലും... ശരീരാവയവം (മർമ) നോക്കി മനസ്സിന്റെ അവസ്ഥ പറയാം. എന്നാൽ സ്ത്രീ വർഗ്ഗം അങ്ങനെയല്ല.... (സാധാരണ കാഴ്ചയിൽ) ഒരു എക്സ്പോഷറും ഉണ്ടാകില്ല..... 2 സ്ത്രീകൾ ഒരുമിച്ച് എന്ത് ചെയ്യും? കുഞ്ഞ് ജനിക്കില്ല.... നിയമപരമായ അംഗീകാരം നൽകരുത്... അല്ലി രാജ്യം എന്ന് നമ്മൾ വായിച്ചിട്ടുണ്ട്.. പണ്ട് സ്ത്രീകൾ സ്വതന്ത്രരും അനിയന്ത്രികരുമായിരുന്നു, എന്നാൽ നൂറുകണക്കിന് വർഷങ്ങൾക്ക് ശേഷം അവരെ പൂട്ടിയിട്ടു? വിശദാംശങ്ങളൊന്നും മനസ്സിലാക്കാതെ നമ്മൾ ചെയ്യുന്നത് (ഡ്രാഗുല- സിനിമയിലെ പോലെ തുറന്നു പറയുമോ എന്ന ഭയം... ) നമ്മൾ എവിടെ പോകും... പ്രകൃതിക്കെതിരായ ഈ കളി? 4 തലമുറകൾക്കുള്ളിൽ പുരുഷവർഗ്ഗം കരകഗ്രഹത്തിൽ കിടക്കേണ്ടി വരുന്ന ദിവസം വരും....	Homophobic	eng_ml
675	സഹോദരാ, ഈ വീഡിയോ കാണാൻ എല്ലാ ട്രാൻസ്‌ജെൻഡേഴ്സും അഭിമാനിക്കുന്നു. Tku	Non-anti-LGBT+ content	eng_ml
676	ചെനില ട്രാൻസ്‌ജെൻഡർ, ഗണേഷ് 3/10, അഗ്രഹാരം ഈസ്റ്റ് മൂന്നിർപള്ളം, എനിക്ക് നിന്നോട് സ്നേഹവും വാത്സല്യവും ഉണ്ട്.	Non-anti-LGBT+ content	eng_ml
677	അവൾ ഒരു മന്ത്രവാദിനിയാണ്..സുന്നത്തിന്റെ മഹത്വം അറിയാത്ത പിഞ്ച വട ..പുണ്ടൈയോട് പുണ്ടൈ ..സുന്നിയോട് സുന്നി .....അയ്യോ നാഥാ ..അവളെ നോക്കിയാൽ ഒരു സുന്നയും ഉദിക്കില്ല ...അവൾ എങ്ങനെ ചെയ്യും ഒരു കുട്ടിയുണ്ട് ...അവൾക്ക് സുന്നി ഇല്ലാത്ത കുട്ടി ഉണ്ടാകുമോ ???	Homophobic	eng_ml
678	അവൾ ആരാധിക്കപ്പെടാൻ അർഹയാണ്. ആയിരം വർഷമല്ലെങ്കിൽ ആയിരക്കണക്കിന് വർഷങ്ങളോളം ആശങ്കകളില്ലാതെ സന്തോഷത്തോടെ ജീവിക്കാൻ ഞാൻ ദൈവത്തോട് പ്രാർത്ഥിക്കുന്നു	Non-anti-LGBT+ content	eng_ml
679	അന്തവൻ ഉണ്ട്, ചേച്ചി വിഷമിക്കണ്ട	Non-anti-LGBT+ content	eng_ml
680	ഈ മനസ്സാണ് സർ ദൈവമാണ് ഹൃദയം-കണ്ണുകളോടെ_മുഖം_ചിരിക്കുന്നു	Non-anti-LGBT+ content	eng_ml
681	ജയ് മണിവേൽ : താങ്കളുടെ അഭിനയം അതിശയിപ്പിക്കുന്നതാണ്... ബോധവൽക്കരണ വീഡിയോ പോസ്റ്റ് ചെയ്തതിൽ നല്ല കാര്യം... സാമൂഹ്യ പ്രതിബദ്ധത, ജീവകാരുണ്യ പ്രവർത്തനങ്ങൾക്ക് ആശംസകൾ സുഹൃത്തേ...	Non-anti-LGBT+ content	eng_ml
682	കലങ്ങിയ കണ്ണുകളോടെ ഞാൻ കണ്ട ആദ്യത്തെ തമാശ	Non-anti-LGBT+ content	eng_ml
683	നിങ്ങൾ വളരെ സുന്ദരിയാണ് അമ്മ.. സമൃദ്ധമായി കൈകൾ മടക്കി_കൈകൾ മടക്കി_കൈകൾ കൊണ്ട് ജീവിക്കുക	Non-anti-LGBT+ content	eng_ml
684	സൈറ്റ് ആണ് ഏറ്റവും നല്ല സംഭാവന ഇപ്പോൾ സൗഹൃദമാണ് മികച്ച ട്രാൻസ്ജെൻഡർ സുഹൃത്ത് അവൾ ഈ ഫീൽഡ് നേടും ഒരിക്കൽ അവൾ ഒരു സ്ത്രീ സ്ത്രീ സ്ത്രീ സ്ത്രീ സ്ത്രീ ആണ് അവൾ ഇതെല്ലാം ചോദിച്ചു അവൾ മിടുക്കനാണോ എന്ന് ചോദിച്ചു അവൾ ആണ് നോക്കേണ്ടത് അവൾ പറഞ്ഞു. പെൺകുട്ടികളെ വിവാഹം കഴിക്കുക.	Non-anti-LGBT+ content	eng_ml
685	ആർട്ടിഫിഷ്യൽ ഇന്റലിജൻസ് എന്ന് പറയുന്നവർ പോയത് അച്ഛനോ അമ്മയോ?	Homophobic	eng_ml
686	നിങ്ങൾ തൊട്ടുകൂടാത്ത വിഷയങ്ങളെ കുറിച്ച് സംസാരിക്കുമ്പോൾ ഇനി മുതൽ നിങ്ങളുടെ വീഡിയോകളൊന്നും ഞാൻ കാണില്ല തലയോട്ടി_കൂടെ_കൂടെ എല്ലുകൾ പ്രകോപിതരാകുന്നു	Non-anti-LGBT+ content	eng_ml
687	നിങ്ങൾക്ക് മറുപടി നൽകിയതിന് നന്ദി, കൈകൾ മടക്കി	Non-anti-LGBT+ content	eng_ml
688	എല്ലാ ജീവജാലങ്ങളിലും ഒരു ഗേ ലെസ്ബിയൻ കോമ്പിനേഷൻ ഉണ്ട്.അത് ആദ്യം മനസിലാക്കുക.പിന്നെ എല്ലാ മനശ്ശാസ്ത്രജ്ഞരും ഇത് സ്വാഭാവികമാണെന്ന് പറഞ്ഞു.നമ്മൾ പറയുന്നതിനെ കുറിച്ച് സംസാരിക്കരുത്.എല്ലാവർക്കും ഒരു കാഴ്ചപ്പാട് ഉണ്ടായിരിക്കണം.അത് ആരെങ്കിലും തെളിയിക്കട്ടെ ഒരു മാനസിക രോഗമാണ്, അത് ഞങ്ങളോട് ചെയ്യാൻ പറയൂ, ഡോക്ടർ ശാലിനി പറയുന്നത് കേൾക്കരുത്. ലോകം മുഴുവനും ഇത് അംഗീകരിച്ചു.ഇന്ത്യ വന്നിട്ട് വർഷങ്ങളായി.ഇത്രയും വർഷമായി അവിടെ കഴിയുന്ന ട്രാൻസ്ജെൻഡേഴ്സിനെ പരിചരിക്കുന്ന മനോഭാവത്തിലേക്ക് ഇന്നത്തെ തലമുറ വരട്ടെ.. അപ്പോൾ തീർച്ചയായും ഈ കാര്യം മാറും. ഇനി വരുന്ന തലമുറ ജനിക്കില്ല എന്ന് പറയരുത്, എത്രയെത്ര അനാഥാലയങ്ങൾ ഉണ്ടെന്ന് അറിയാമോ? ഒന്നാമതായി അവരെ കാമമെന്ന മുദ്രകുത്തരുത്.. ഇതും ഒരു പ്രണയമാണ്.. നമ്മൾ മനസ്സിലാക്കണം.. ഞാനും; അവനാണ് നിന്നെ കളിയാക്കിയത്, പക്ഷെ ഞാൻ ഇത് മനസ്സിലാക്കി അവനെ പിന്തുണച്ചു, ശരി. നമുക്ക് കാണാൻ കഴിയുന്നത് മാത്രമല്ല ലോകം.അറിയുന്നത് മാത്രമല്ല അറിവ്.	Non-anti-LGBT+ content	eng_ml
689	സ്വവർഗാനുരാഗ കാലത്തിന് പ്രഭാതത്തോളം പഴക്കമുണ്ട്. ഇത് പുതിയ കാര്യമാണെന്ന് ആളുകൾ കരുതുന്നു. ജീവിക്കു ജീവിക്കാൻ അനുവദിക്കു. മറ്റൊരാളുടെ ജീവിതത്തിൽ ഇടപെടരുത്. ഇത് നിങ്ങളെ ബാധിക്കുന്നില്ലെങ്കിൽ, എന്തിന് വിഷമിക്കണം?	Non-anti-LGBT+ content	eng_ml
690	ഇതുപോലുള്ള ട്രാൻസ്ജെൻഡേഴ്സിന് എല്ലാത്തിനും ചീത്തപ്പേരുണ്ട്	Non-anti-LGBT+ content	eng_ml
691	കൂലിവേലയെ ആരെങ്കിലും വിലക്കുന്നുണ്ടോ?	Non-anti-LGBT+ content	eng_ml
692	ട്രാന് സ് ജെന് ഡറുകളെ കണ്ടാല് പ്രകോപിതരാകുന്ന ഇവരെയൊക്കെ എന്തിനാണ് വെറുതെ വിടുന്നത്?	Transphobic	eng_ml
693	ബോഡി വെണ്ണ, പോയി നിന്റെ അമ്മ നീതി സഞ്ജുവിനൊപ്പം ഒരു ഗേ ലെസ്ബിയൻ ബന്ധം സ്ഥാപിക്കൂ	Homophobic	eng_ml
694	യോ ഇത് ലൈംഗികതയ്ക്ക് വേണ്ടിയുള്ള പോരാട്ടമാണ്. കാമത്തിനു വേണ്ടിയല്ല	Non-anti-LGBT+ content	eng_ml
695	തമാശയാണെങ്കിലും നല്ല മനസ്സുള്ളവളാണ് ആ സഹോദരി.	Non-anti-LGBT+ content	eng_ml
696	ആ സഹോദരിയിൽ ദേവിയെ കണ്ടവർ...ആരാ...ആരാ?	Non-anti-LGBT+ content	eng_ml
697	ആ വാത്സല്യം....; വിവരിക്കാൻ കൊള്ളാത്ത പ്രൊഫ. ഭിന്നലിംഗക്കാർ; ഒരേ സമയം സ്ത്രീയായും പുരുഷനായും ചിന്തിക്കാനും പ്രവർത്തിക്കാനും കഴിവുള്ള മാന്യരായ ആളുകൾ.; ; ആ കുട്ടിക്ക് വേണ്ടി നടുറോഡിൽ നൃത്തം ചെയ്യരുത്...; ആ മനസ്സുണ്ട്... കണ്ണീരിൽ ഒലിച്ചുപോയ ഒരു വെളുത്ത മനസ്സ് പ്രോ	Non-anti-LGBT+ content	eng_ml
698	25 വർഷത്തിലേറെയായി പോരാടേണ്ടത് പ്രധാനമല്ലേ?	Non-anti-LGBT+ content	eng_ml
699	ഞാൻ വെങ്കടേഷ്  വട ഐതകാരി മുണ്ട..ആപ്തിയേ ഗുണി	Non-anti-LGBT+ content	eng_ml
700	ഈച്ചകൾ അരവ പുണ്ടായി യാചിക്കുമ്പോൾ പ്രസംഗം നോക്കൂ	Transphobic	eng_ml
701	അതാദേവിയാപായ. പണത്തിനു വേണ്ടി പാവാട എന്നെ കാണിക്കരുത് നായേ	Transphobic	eng_ml
702	ഭാഗം 2 ന്റെ കാര്യമോ?	Non-anti-LGBT+ content	eng_ml
703	തിളങ്ങുന്ന_നക്ഷത്രം എന്താണ് ഇവിടെ നടക്കുന്നത്? നമ്മൾ തമിഴരാണെന്ന് ചുരുക്കം ചിലർ പറയുന്നു.. ഞങ്ങൾ ദ്രാവിഡരാണെന്ന് ചുരുക്കം ചിലർ പറയുന്നു.. ഞങ്ങൾ ഇവിടെയുമില്ല അവിടെയുമില്ല നടുവിലുമില്ലെന്നാണ് കമൽ പറയുന്നത്.	Non-anti-LGBT+ content	eng_ml
704	സൂപ്പർ പാർട്ണർ, എന്നാൽ ഈ ഖണ്ഡികയെ കുറിച്ച് ഞാൻ എന്താണ് ചിന്തിക്കുന്നതെന്ന് നിങ്ങൾക്കറിയാമോ, ഈ ഹോമോ സെക്‌സ് ഒരു പരിണാമ വികാസമായി തോന്നുന്നു, ഇത് ഒരു മിശ്രജാതി പോലെ തോന്നുന്നു, കുരങ്ങുകളിൽ നിന്നാണ് മനുഷ്യർ പരിണമിച്ചത്, ഈ സങ്കരത്വം വർദ്ധിച്ചാൽ, മനുഷ്യ വംശനാശത്തിന് സാധ്യതയുണ്ട്, തുടക്കം ചെറുതായിരിക്കും,,?	Homophobic	eng_ml
705	അവന്റെ മനസ്സിനെ ആശ്രയിച്ച് അവൻ വ്യത്യസ്തമായി ചിന്തിക്കുന്നു	Non-anti-LGBT+ content	eng_ml
706	എല്ലാത്തിനും സൂപ്പർ നന്ദി	Non-anti-LGBT+ content	eng_ml
707	നിങ്ങളുടെ മൊബൈൽ	Non-anti-LGBT+ content	eng_ml
708	ജാതി കൊണ്ട് വേർതിരിച്ചാൽ മതി, മതം കൊണ്ട് ഭിന്നിച്ചാൽ മതി, മനുഷ്യ പ്രകൃതമാണ് ഏക പരിഹാരം.	Non-anti-LGBT+ content	eng_ml
709	ഇത് വ്യക്തിഗത തിരഞ്ഞെടുപ്പാണ്, അതിൽ ആരും ഇടപെടരുത്, നമ്മുടെ ജീവിതം	Non-anti-LGBT+ content	eng_ml
710	എം	Non-anti-LGBT+ content	eng_ml
711	ട്രാൻസ്‌ജെൻഡർ വേശ്യാവൃത്തി ശരിയോ തെറ്റോ എന്റെ ഉത്തരം വളരെ തെറ്റാണ്, ഈ പട്ടണത്തിലെ ഊളയിൽ ആളുകൾ താമസിക്കുന്നില്ലേ, ഞാൻ ട്രാൻസ്‌ജെൻഡറാണ്, ഞാൻ വ്യത്യസ്തനല്ല, പക്ഷേ അവർ വേശ്യാവൃത്തിക്കാരാണ്, ദയവായി അവർ മാണിക്കുളത്തെ എങ്ങനെ അംഗീകരിക്കും?	Non-anti-LGBT+ content	eng_ml
712	ജീവിതം തനിക്കു വേണ്ടി മാത്രം ജീവിക്കുന്നതാണ്.ജീവിതത്തിൽ നിയന്ത്രണമില്ലെങ്കിൽ ലോകം ചുട്ടുപൊള്ളും	Homophobic	eng_ml
713	നശിക്കാനുള്ള പരമമായ മാർഗമാണ് നസാമ. അത് ദൈവത്തിന്റെ ഏറ്റവും വലിയ പാപമാണ്. അങ്ങനെയാണ് ദൈവം സോദോമിനെയും ഗൊമോറയെയും സോദോമിന്റെയും ഗൊമോറയുടെയും മണ്ണിൽ പൊടിയാക്കിയത്. കൊറോണ പോലൊരു ഫലം ഇനി വരാതിരിക്കാൻ നമുക്ക് ഇതിനെ നിയമപരമായി തെറ്റ് എന്ന് വിളിക്കാം. സോദോമിന്റെയും ഗൊമോറയുടെയും നാശത്തിന്റെ തെളിവുകൾ ഭൂമിയിലുണ്ട്.	Homophobic	eng_ml
714	കണ്ണുനീർ നിറഞ്ഞ കൈകൾ	Non-anti-LGBT+ content	eng_ml
715	പ്രിയ സുഹൃത്തേ, ഈ സംഭവം നടന്നത് ഇരോട് ജില്ലയിൽ അല്ല, അതിനാൽ ഈ പോസ്റ്റ് ഡിലീറ്റ് ചെയ്യണമെന്ന് വിനീതമായി അഭ്യർത്ഥിക്കുന്നു	Non-anti-LGBT+ content	eng_ml
716	പറയാനുള്ളത് വ്യക്തമായി പറഞ്ഞു തന്നു...കൊള്ളാം......ശരിക്കും സൂപ്പർ.....	Non-anti-LGBT+ content	eng_ml
717	സുഹൃത്തേ, നിങ്ങൾക്കിത് ഇപ്പോൾ കാണാൻ കഴിയുമെന്ന് തോന്നുന്നു	Non-anti-LGBT+ content	eng_ml
718	അതിശയിപ്പിക്കുന്ന നിങ്ങളുടെ വീഡിയോ ഉച്ചത്തിൽ_കരയുന്ന_മുഖം ആ സഹോദരി ഒരു അനുഗ്രഹമാണ്	Non-anti-LGBT+ content	eng_ml
719	ആത്മയെ പ്രചോദിപ്പിക്കുന്നത് തറയിൽ_ചിരിക്കുന്ന_എന്റെ മകൾ കാണാൻ ആഗ്രഹിക്കുന്നു	Non-anti-LGBT+ content	eng_ml
720	അവർക്ക് വളരെ നല്ല ഹൃദയമിടിപ്പ്_ഹൃദയം തുടിക്കുന്ന_ഹൃദയമുണ്ട്	Non-anti-LGBT+ content	eng_ml
721	{Singal tee machi u tube} ചാനലിനെ പോലെ നിങ്ങൾക്കും പോയി part 2 34 prank എടുക്കാമോ. അത് സത്യമാകുമെന്ന് നമുക്ക് പ്രതീക്ഷിക്കാം	Non-anti-LGBT+ content	eng_ml
722	പൊതു ആരാധകർ തെണ്ടികളാണ്.	Transphobic	eng_ml
723	അറിവ് മോശമാണ്	Non-anti-LGBT+ content	eng_ml
724	സുന്ദരനായ സംസാരി, നിങ്ങളുടെ സംസാരം മനോഹരമാകുമോ?	Non-anti-LGBT+ content	eng_ml
725	മറച്ചുവെക്കാൻ ശ്രമിക്കാതെ അവൻ യാമയോട് സത്യം പറഞ്ഞു	Non-anti-LGBT+ content	eng_ml
726	ക്ഷമിക്കണം. ദൈവം നിന്നെ അനുഗ്രഹിക്കട്ടെ	Non-anti-LGBT+ content	eng_ml
727	മുഖ ബവാനായി അരമുത്ത് നമ്പ അഭിനയത്തിന് ആശംസകൾ നേരുന്നു.	Non-anti-LGBT+ content	eng_ml
728	എന്തുകൊണ്ടാണ് നിങ്ങൾ ഇത്രയധികം അഭിമുഖം ചെയ്യേണ്ടത്?	Non-anti-LGBT+ content	eng_ml
729	ഇന്നയാണ് ഗ്രാമത്തിന്റെ നേതാവ്	Non-anti-LGBT+ content	eng_ml
730	Mohamed Sameer നിങ്ങളുടെ മതത്തിലെ ഈ സ്വവർഗാനുരാഗികളെ എന്ത് ചെയ്യണം എന്ന് പറയാമോ തുൽക്ക നായ...	Non-anti-LGBT+ content	eng_ml
731	അയ്യോ... ആ പയ്യൻ എങ്ങനെ പെരുമാറുന്നു എന്ന് ഞാൻ അത്ഭുതപ്പെടുന്നു. മറ്റൊരു തലം...	Non-anti-LGBT+ content	eng_ml
732	ഒരു നല്ല കാര്യം വ്യക്തമായി പറഞ്ഞാൽ എന്ത് സംഭവിക്കുമായിരുന്നു എന്ന് ചിന്തിക്കേണ്ട വാർത്തയാണ്	Non-anti-LGBT+ content	eng_ml
733	തവരുത്തൻ തെറ്റാണ് .തെറ്റില്ലെന്ന് പറയുന്ന കോടതി തെറ്റുകൾ വരുത്താനും ലാഭം നോക്കാനും ആളുകളെ പ്രേരിപ്പിക്കാൻ ശ്രമിക്കുന്നത് മനുഷ്യരാശിക്ക് അപകടമാണെന്ന് തോന്നുന്നു.	Homophobic	eng_ml
734	എല്ലാ ട്രാൻസ്ജെൻഡേഴ്സിനും നല്ല സ്വഭാവമുണ്ട്	Non-anti-LGBT+ content	eng_ml
735	അത് വിലമതിക്കുന്ന ഒരു വികാരമാണ്	Non-anti-LGBT+ content	eng_ml
736	ജാതി കൊണ്ട് വേർതിരിച്ചാൽ മതി, മതം കൊണ്ട് ഭിന്നിച്ചാൽ മതി, മനുഷ്യ പ്രകൃതം മാത്രമാണ് പരിഹാരം ട്രാൻസ്ജെൻഡർ അക്കാ ജീവിത സമ്പത്തുമായി ഞാൻ ലോവ യു അക്കാ	Non-anti-LGBT+ content	eng_ml
737	ഉടൻ തന്നെ ഗാനം 2 ഇടുക	Non-anti-LGBT+ content	eng_ml
738	iniyan prasath നിങ്ങളുടെ കുടുംബത്തിൽ ട്രാൻസ്ജെൻഡർ എന്ന് പറഞ്ഞാൽ തീർച്ചയായും ഒരു ട്രാൻസ്ജെൻഡർ എന്റെ സഹോദരനായി ജനിക്കും.	Non-anti-LGBT+ content	eng_ml
739	ലോകം അവസാനിക്കാൻ പോകുന്നില്ല. സോദോമിന്റെ സ്വവർഗരതിയുടെ പാപം അക്കാലത്ത് സോദോം പൊടിയിൽ മൂടിയിരുന്നു. സ്വവർഗാനുരാഗികളെ ദൈവം വെറുതെ വിടില്ല. അതിൽ പറയുന്ന കാര്യമാകട്ടെ, ഏറ്റവും വലിയ പാപം സ്വവർഗരതിയാണ്.	Homophobic	eng_ml
740	ശരിക്കും നിങ്ങൾ നന്നായിരിക്കും thumbs_up thumbs_up thumbs_up thumbs_up thumbs_up thumbs_up thumbs_up thumbs_up thumbs_up	Non-anti-LGBT+ content	eng_ml
741	ട്രാൻസ്‌ജെൻഡർ പ്രണയം പ്രിയപ്പെട്ടതാണ്.	Non-anti-LGBT+ content	eng_ml
742	നല്ല സാങ്കേതിക വിദ്യയായ മാലിനി ഉത്തരം പറയാതെ വീണ്ടും ചോദ്യം ചോദിക്കുന്നു.	Non-anti-LGBT+ content	eng_ml
743	ചില ട്രാൻസ് ആളുകൾ തെറ്റുകൾ വരുത്തുന്നു. ഈ സഹോദരിയെപ്പോലെ ഒരുപാട് നല്ല മനുഷ്യർ ഉണ്ട്	Non-anti-LGBT+ content	eng_ml
744	ഒരു പ്രണയബന്ധം. അനാഥൻ എന്നാൽ ഇന്ത്യയിൽ മനസ്സിലാകുന്ന ഒന്നല്ല.	Non-anti-LGBT+ content	eng_ml
745	അബ്ദുറഹ്മാൻ നീ ഇങ്ങനെ സംസാരിക്കുന്നു..അവർ പാപിയായ മനുഷ്യരാണ്.കുറച്ചുപേരെ കുറ്റം പറയരുത്..ഈ ലോകത്ത് എല്ലാവരും വികലാംഗരാണ്.തെറ്റ് ചെയ്യുന്നവർ എല്ലായിടത്തും ഉണ്ട്..	Non-anti-LGBT+ content	eng_ml
746	Aranganathan Ak ദൈവത്തിന് ഇതിൽ തെറ്റില്ല മാനസിക വിഭ്രാന്തിക്കും സമൂഹത്തിനും കാരണം അവനാണ്.	Homophobic	eng_ml
747	നിങ്ങൾക്ക് സംഭവിച്ച അനീതികളും നിങ്ങളുടെ ആവശ്യങ്ങളും സംഗ്രഹിച്ചതിന് അരുൺ അണ്ണന് ഒരുപാട് നന്ദി...	Non-anti-LGBT+ content	eng_ml
748	തീർച്ചയായും പിന്തുണയ്ക്കില്ല...	Non-anti-LGBT+ content	eng_ml
749	ഏതാനും ട്രാൻസ്സെക്ഷ്വലുകൾ വഴി	Non-anti-LGBT+ content	eng_ml
750	ഇതൊരു 9-പോയിന്റ് ട്രബിൾ ബഫറാണ്	Transphobic	eng_ml
751	രണ്ട് ദിവസം മുമ്പ് ഒരാളെ ട്രെയിനിൽ നിന്ന് പിടിച്ച് തള്ളിയിരുന്നു	Non-anti-LGBT+ content	eng_ml
752	ദൈവം ഉറപ്പായും കൂപ്പുകൈകൾ നേരിടും	Non-anti-LGBT+ content	eng_ml
753	പരിസ്ഥിതിയെ നശിപ്പിക്കുന്നതിനേക്കാൾ നല്ലത് മറ്റുള്ളവർക്ക് വേണ്ടി ജീവിക്കുന്നതാണ് ഗേ....	Homophobic	eng_ml
