	text	category	ln
1261	നമ്മൾ സ്കൂളിൽ പഠിക്കുമ്പോഴെല്ലാം ഇന്ത്യയിൽ ലെസ്ബിയൻ ഗേകളെക്കുറിച്ച് കേൾക്കില്ല, നമ്മൾ കോളേജിൽ പോകുമ്പോൾ, സ്വവർഗ്ഗാനുരാഗികളെ വിദേശത്ത് ആളുകൾ ആക്രമിക്കുന്നു, ന്യൂസ് പാത്ത് 2018 അവസാനിക്കുമ്പോൾ, തമിഴ്നാട്ടിൽ ഇത്തരത്തിലുള്ള ഭരണം കൂടുതലാണ്. ഇത് പ്രകൃതിവിരുദ്ധമാണ്. അഞ്ചുവർഷമായി മദ്യപിച്ചിട്ട് അഞ്ചുവർഷമായി ചൊറിയുകയും ചീത്തവിളിക്കുകയും ചെയ്ത എനിക്ക് ലെസ്ബിയൻമാരെ കാണുമ്പോൾ അസൂയ തോന്നുന്നു. എന്തുകൊണ്ടാണ് ഞാൻ എന്റെ ഉഭയജീവിയായ കണ്ണിറുക്കുന്ന_മുഖത്തിലേക്ക്_നാവുകൊണ്ട് മാത്രം ആകർഷിക്കപ്പെടുന്നത്	Non-anti-LGBT+ content	eng_ml
1262	എന്താണ് മദൻ ദ്രാവിഡൻ? ദ്രാവിഡം. തമിഴ്ദേശീയത്തിൽ എന്താണ് സംഭവിച്ചത്? ചില പാർട്ടികൾ ദ്രാവിഡവാദമാണ് പിന്തുടരുന്നത്. ചില പാർട്ടികൾ തമിഴ് തമിഴ്ദേശീയത്നം പിന്തുടരുന്നു, അതിനാൽ വ്യത്യാസം പറയുക.	Non-anti-LGBT+ content	eng_ml
1263	ഇതാണ്. പ്രതിഷേധിച്ചു. എല്ലാം ശരി. അവൻ ആണ് പോലെ കുട്ടി . സമ്പത്ത്. ജനിക്കും ആശംസകൾ. അടിമയായി.....	Non-anti-LGBT+ content	eng_ml
1264	സാമിയെ സാമി എന്ന് വിളിക്കുന്നത് എന്ത് ഭംഗിയാണ്	Non-anti-LGBT+ content	eng_ml
1265	ട്രാൻസ്‌ജെൻഡറിന് മോശമായി പെരുമാറിയാൽ പോലീസിൽ പരാതി നൽകാം	Non-anti-LGBT+ content	eng_ml
1266	പന്നുവാനല സ്വവർഗ്ഗാനുരാഗ പനൂരവങ്ങാടന പോലെയുള്ള ഈ നീച വീഡിയോക്ക് 5 മില്യൺ ലൈക്കുകൾ.. നാണമില്ല.. ചി ഠൂ.. സ്വവർഗാനുരാഗികൾ എയ്ഡ്സ് എന്ന മാരക രോഗം പരത്തുന്നു.. നിങ്ങൾ കൊലയാളികളാണോ.. നിങ്ങൾക്ക് നല്ലൊരു മരണം ഉണ്ടാകില്ല.. അടിത്തട്ടിലേക്ക് പോകാൻ നിങ്ങൾ പോരാടണം. നിങ്ങളുടെ മരണം ആണവപീഡനത്തോടൊപ്പമായിരിക്കും.ഒരാളുടെ ജീവിതകാലത്തെ മരണം നാളെ കർത്താവായിരിക്കും.അതറിഞ്ഞ് ജീവിക്കാൻ അയച്ചാൽ മനുഷ്യകുലം തെറ്റുകളിൽ നിന്ന് ഉണരും.മരണത്തെ സമീപിക്കുന്ന നിങ്ങളെപ്പോലുള്ള സ്വവർഗാനുരാഗികളെ ബോധവാന്മാരാക്കണം അതിനായി ഞാൻ എന്റെ നാഥനോട് പ്രാർത്ഥിക്കുന്നു.	Homophobic	eng_ml
1267	സാമൂഹികമായ കാഴ്ചപ്പാടുകളും സത്യങ്ങളും പങ്കുവെക്കുന്ന രീതി അതിമനോഹരം..അഭിനന്ദനങ്ങൾ സഹോദരി..	Non-anti-LGBT+ content	eng_ml
1268	പാപം വർദ്ധിക്കുന്നതിനനുസരിച്ച് ലോകം നശിക്കും	Homophobic	eng_ml
1269	Bro neenga thappa purinjirukinga; അത് ദൈവത്തിന്റെ കുറ്റമല്ല.; (ട്രാൻസ്‌ജെൻഡർ) ഹോർമോൺ വ്യതിയാനം മൂലം ട്രാൻസ്‌ജെൻഡറുകൾ മാറുന്നു, പക്ഷേ സ്വവർഗരതിയുടെ (ഗേ) തെറ്റായ ചുറ്റുപാടിൽ വളരുന്ന തലമുറകൾ വലിയ തെറ്റാണ്, ഈ ചിന്ത മനസ്സിൽ വരുമ്പോൾ, ഇത് ബന്ധുക്കളല്ല, മുതിർന്നവരാണ് തിരുത്തേണ്ടത്. വലിയ നാണക്കേടാണ്. അതിനെ പിന്തുണയ്ക്കരുത്, കഴിയുന്നത്ര മറ്റുള്ളവരെ തിരുത്താൻ ശ്രമിക്കുക; നമ്മുടെ സമൂഹം നമ്മുടെ ആളുകളാണ്; ; യേശു നിങ്ങളെ അനുഗ്രഹിക്കട്ടെ	Homophobic	eng_ml
1270	പുരുഷന്മാരെ ഇഷ്ടപ്പെടാത്ത സ്ത്രീകൾ ഈ വഴി പിന്തുടർന്നാൽ പുരുഷൻമാർ കഷ്ടപ്പെടും	Non-anti-LGBT+ content	eng_ml
1271	ഗേ ലെസ്ബിയൻ ഉൾപ്പെടുത്തൽ മൂലം ജനസംഖ്യ കുറയുന്നത് നല്ലതാണെങ്കിലും പ്രകൃതിവിരുദ്ധ പ്രവർത്തനം ഉപയോഗശൂന്യമാണ്.	Homophobic	eng_ml
1272	നല്ല പോസ്റ്റ് ചേട്ടാ	Non-anti-LGBT+ content	eng_ml
1273	മനഃസാക്ഷിയോടും വിശ്വാസികളോടും ദൈവത്തോടും സത്യസന്ധത പുലർത്തണം, ജീവിതത്തെക്കാൾ ധാർമ്മികതയെ പരിഗണിക്കണം, മറ്റുള്ളവരുടെ വസ്തുവകകളോട് അത്യാഗ്രഹം കാണിക്കരുത്, നമ്മുടെ പ്രവൃത്തികൾ നമ്മുടെ ഹൃദയാഭിലാഷങ്ങൾക്കനുസൃതമായിരിക്കരുത്, ആരെയും പ്രേരിപ്പിച്ച് ലാഭം കൊയ്യരുത്, നമ്മൾ കള്ളം പറയരുത്, മറ്റുള്ള ജീവിതങ്ങളെ ബഹുമാനിക്കണം. കോടതിയുടെ ഈ വിധിയെ ഞാൻ പൂർണ്ണഹൃദയത്തോടെ പിന്തുണയ്ക്കുകയും ഹൃദയപൂർവ്വം അംഗീകരിക്കുകയും ചെയ്യുന്നു.	Non-anti-LGBT+ content	eng_ml
1274	അണ്ണാ സൂപ്പർ സിസ്റ്റർ നീണ്ട നൂറ്_പോയിന്റ് നൂറ്_പോയിന്റ് നൂറ്_പോയിന്റ് നൂറ്_പോയിന്റ്	Non-anti-LGBT+ content	eng_ml
1275	നലൂ പെർ സെർദണ്ഡു (......)ഉച്ചച്ചാ സാരി ......പൊതുവായത്	Non-anti-LGBT+ content	eng_ml
1276	ബസിലെ തിരക്ക് സഹിക്കാനാവുന്നില്ല. നിങ്ങൾ 10 രൂപ നൽകണം അല്ലെങ്കിൽ അവർ നിങ്ങളെ ശപിക്കും	Transphobic	eng_ml
1277	ഞാൻ വെങ്കടേഷ്  വട ഐതകാരി മുണ്ട..ആപ്തിയേ ഗുണി	Non-anti-LGBT+ content	eng_ml
1278	ബ്രോ എന്റെ ഹൃദയം വേദനിക്കുന്നു ബ്രോ.. ആ സഹോദരിയോട് ശരിക്കും ബഹുമാനം... മടക്കി_കൈകൾ മടക്കി_കൈകൾ മടക്കി_കൈകൾ മടക്കി_കൈകൾ ചുവന്ന_ഹൃദയം ചുവന്ന_ഹൃദയം ചുവന്ന_ഹൃദയം ചുവന്ന_ഹൃദയം തംബ്സ്_അപ്പ് തംബ്സ്_അപ്പ് തംബ്സ്_അപ്പ്	Non-anti-LGBT+ content	eng_ml
1279	ഇത്രയും നല്ല ജോലി ചെയ്തതിന് നന്ദി	Non-anti-LGBT+ content	eng_ml
1280	ഹേ ദേവീഡിയ, ദയവായി ഇതിന്റെയെല്ലാം ഒരു വീഡിയോ പോസ്റ്റ് ചെയ്യുക	Non-anti-LGBT+ content	eng_ml
1281	നിങ്ങൾ ചെയ്യുന്നത് നിന്ദ്യമാണ്. നമുക്കുള്ള ചില യഥാർത്ഥ സൗഹൃദങ്ങൾ നഷ്ടപ്പെടുന്നതിനും ഇത് കാരണമാകും. നമ്മളെ തുറിച്ചുനോക്കാൻ/സംശയത്തോടെ/വ്യത്യസ്‌തമായി നോക്കാൻ എത്രയോ വഴികളുണ്ടെന്ന് അറിഞ്ഞുകൊണ്ട് നിങ്ങൾ ഇങ്ങനെ സംസാരിക്കുന്നതിൽ വിഷമമുണ്ട്. ചുറ്റുപാടുമുള്ള കാമ ലാഭം മാത്രം അന്വേഷിക്കുന്നവർക്കേ ഇങ്ങനെ ചിന്തിക്കാൻ കഴിയൂ.	Homophobic	eng_ml
1282	നിങ്ങളുടെ വികാരങ്ങളെ ഞാൻ ബഹുമാനിക്കുന്നു, പക്ഷേ നിങ്ങൾ ദേഷ്യപ്പെടുമ്പോൾ മാത്രമാണ് എനിക്ക് നിങ്ങളോട് ദേഷ്യം തോന്നുന്നത്, ടോയ്‌ലറ്റിലും ബസ്സിലും ലൈൻ കടന്ന് വന്ന രണ്ട് പേർ എന്നെ മർദിച്ചു, നിങ്ങളുടെ വികാരങ്ങൾ ഉള്ളവരോട് മാത്രം നിങ്ങളുടെ വികാരങ്ങൾ സൂക്ഷിക്കുക. മറ്റുള്ളവ കുറ്റമാണ്.	Non-anti-LGBT+ content	eng_ml
1283	ഓരോരുത്തർക്കും ഓരോ വികാരമാണ്... സ്വവർഗരതി ശരിയാണെന്ന് നിയമം പറയുന്നു.. അത് അവരുടെ ഇഷ്ടമാണ്.. അത് തെറ്റാണെന്ന് പറയാൻ നമുക്ക് അവകാശമില്ല..	Non-anti-LGBT+ content	eng_ml
1284	ആങ്കറിംഗ് സ്റ്റാഫ് തലച്ചോറിനെ ചവിട്ടാൻ ആഗ്രഹിച്ചു, പക്ഷേ പെരുസ വന്ന് ഒരു മൈക്ക് എടുത്തു. സർക്കാർ അംഗീകാരം നൽകുന്നതിൽ എനിക്കും നിങ്ങൾക്കും എന്താണ് ചെയ്യേണ്ടത്?	Non-anti-LGBT+ content	eng_ml
1285	പോൾ ദിനകരന്റെ കോളേജ് ഫീസ് 2 ലക്ഷം.... ആദ്യം ബൈബിൾ വാക്യം പറയൂ....	Non-anti-LGBT+ content	eng_ml
1286	എന്റെ പ്രിയ സുഹൃത്തുക്കളെ, ഒരു പുരുഷൻ ശാരീരികമായി പുരുഷനും മാനസികമായി സ്ത്രീയും സ്ത്രീ മാനസികമായി പുരുഷനും ശാരീരികമായി സ്ത്രീയുമാണെന്ന് നാം തിരിച്ചറിയണം.അവരുടെ മനസ്സിനെ നാം ശാസ്ത്രീയമായി മനസ്സിലാക്കണം.	Non-anti-LGBT+ content	eng_ml
1287	മതവിശ്വാസികളോട് വികാരങ്ങളെ കുറിച്ച് സംസാരിക്കാൻ നമ്മൾ ആരാണ്.....അവർ പരസ്പരം അവരുടെ വികാരങ്ങൾക്ക് വില കൊടുക്കുന്നു, അത് മതി കൂപ്പി_കൈകൾ....ഈ ശരി_കൈയിൽ ലിംഗഭേദം ആവശ്യമില്ല.	Non-anti-LGBT+ content	eng_ml
1288	സുഹൃത്തേ, പല്ലില്ലാത്ത വായിൽ എന്തിന് വഴുതനങ്ങ ഉപേക്ഷിക്കണം...നാളെ ഇവൾക്ക് പൊള്ളു വേണ്ട, വഴുതനങ്ങ കൊണ്ടുവന്നാൽ വിപണിയിൽ വഴുതനക്ക് ക്ഷാമം വരും...വഴുതന ആ ഉള്ളിൽ ചൂട് വരും...അവർ മസാല മിക്സ് ചെയ്ത് വിളമ്പും..സൂക്ഷിച്ചു...	Non-anti-LGBT+ content	eng_ml
1289	നിന്നെ കാണുമ്പോൾ എനിക്ക് വിറയൽ വരുന്നു	Non-anti-LGBT+ content	eng_ml
1290	ഇനി നമ്മൾ പേടിക്കേണ്ട... അദ്ദേഹത്തിന്റെ വസ്ത്രധാരണം, ശൈലി, സംസാരം എന്നിവ ഇതിനെ അടിസ്ഥാനമാക്കിയുള്ളതാണ് ...; അവരിൽ നിന്ന് നമ്മുടെ കുട്ടികളെ സംരക്ഷിക്കാം....; വളരെ വ്യക്തമാണ്.. അവർ ഏതെങ്കിലും ബാഹ്യ സ്രോതസ്സുകളാൽ സ്വാധീനിക്കപ്പെടുന്നു എന്ന്....; ഇത്തരക്കാരിൽ നിന്ന് സംരക്ഷിക്കേണ്ടത് സമൂഹത്തിന്റെ ഉത്തരവാദിത്തമാണ്...; സമൂഹം അതിന്റെ കടമ നിർവഹിക്കും...	Homophobic	eng_ml
1291	വളരെ പക്വമായ വാക്ചാതുര്യം	Non-anti-LGBT+ content	eng_ml
1292	നിങ്ങൾ വളരെ സുന്ദരിയാണ് ഹൃദയം_അമ്പ്_ഹൃദയം_അമ്പ്_ഹൃദയം_അമ്പ്_വായ് വായ് വായ്	Non-anti-LGBT+ content	eng_ml
1293	പ്രകൃതിക്കെതിരെ എന്ത് ചെയ്താലും അതിന്റെ അനന്തരഫലം ഭയാനകമാണ്	Homophobic	eng_ml
1294	വലിയ രോഗങ്ങളിൽ നിന്നുള്ള മോചനം	Non-anti-LGBT+ content	eng_ml
1295	അവർ എന്തിനാണ് മിശ്രഭോജനം, പ്രണയം എങ്ങനെ വരും, എപ്പോൾ വരുമെന്ന് എനിക്കറിയില്ല, പക്ഷേ മുമ്പ് എങ്ങനെ ബന്ധം സ്ഥാപിക്കണമെന്ന് എനിക്കറിയില്ല, ഒരിക്കൽ ഞാൻ പ്രാർത്ഥിച്ച് വേളാങ്കണ്ണിയിൽ പോയി നാഗപട്ടണത്ത് പോകാൻ വന്നു. സേലം.പിന്നെ അവർ പറഞ്ഞു രാത്രി 4 മണിക്കാണ് ബസ് എന്ന്.അത് വളരെ കൂടുതലാണ്.65 വയസ്സുള്ള ഒരാൾ വന്ന് എന്റെ അടുത്ത് കിടന്നു.അവൻ നെയ്വേലിക്ക് പോകാം എന്ന് പറഞ്ഞു ഞാൻ അങ്ങനെ ഉറങ്ങി. .പെട്ടെന്ന് ഒരു തോന്നലോടെ ഞാൻ ഉണർന്നു.അന്ന് അവൻ എന്റെ ചുണ്ടിൽ ചുംബിച്ചു ചുംബിക്കുകയായിരുന്നു.ആ സുഖം എനിക്ക് വേണമായിരുന്നു.പിന്നെ അവൻ എന്നെ കിടത്തി അത് അനുഭവിച്ചു.ഒരുതരം സുഖം.അന്ന് മുതൽ ഞാൻ അടിമയായി. അതിലേക്ക്.അന്ന് മുതൽ പ്രായമായവരെ കണ്ടാൽ ഉക്കത്തിൽ പോയി കിടന്നുറങ്ങും.എനിക്ക് 46 വയസ്സായി.	Non-anti-LGBT+ content	eng_ml
1296	വിഷമിക്കരുത് അമ്മേ....നിങ്ങൾ എല്ലാവരും എനിക്ക് അമ്മയാണ്.... താഴ്ത്തിക്കെട്ടിയ_മുഖം_വിയർപ്പോടെ_ നിങ്ങളെ ബഹുമാനിക്കുന്നു... വ്യക്തി_കുമ്പിടുന്നു	Non-anti-LGBT+ content	eng_ml
1297	ഒരു പുരുഷന് താൻ ആഗ്രഹിക്കുന്നതെല്ലാം ഒരു സ്ത്രീയിൽ ഉണ്ട്	Non-anti-LGBT+ content	eng_ml
1298	യാചകരായ ട്രാൻസ്‌ജെൻഡർ അനുകൂലികൾ ഉള്ളിടത്തോളം ഇത്തരം അരാജകത്വം തുടരും. ഈ നായ്ക്കളെ പ്രോത്സാഹിപ്പിക്കാൻ ആർക്കും പണം നൽകരുത്	Transphobic	eng_ml
1299	മൂല്യ പ്രതിഭ ... Plss gender pakkathiga ...	Non-anti-LGBT+ content	eng_ml
1300	എല്ലാവരോടും ഒരു കാര്യം പറയാൻ ആഗ്രഹിക്കുന്നു.	Non-anti-LGBT+ content	eng_ml
1301	വിഷമിക്കരുത് അമ്മേ....നിങ്ങൾ എല്ലാവരും എനിക്ക് അമ്മയാണ്.... താഴ്ത്തിക്കെട്ടിയ_മുഖം_വിയർപ്പോടെ_ നിങ്ങളെ ബഹുമാനിക്കുന്നു... വ്യക്തി_കുമ്പിടുന്നു	Non-anti-LGBT+ content	eng_ml
1302	മടക്കിയ_കൈകൾ മടക്കിയ_കൈകൾ മടക്കിയ_കൈകൾ ... വേറൊന്നും ആഗ്രഹിക്കുന്നില്ല ... അപേക്ഷിക്കുന്ന_മുഖം അപേക്ഷിക്കുന്ന_മുഖം ....	Non-anti-LGBT+ content	eng_ml
1303	രാജ്കുമാർ സി	Non-anti-LGBT+ content	eng_ml
1304	ഈ നായ്ക്കളെ ഏറ്റുമുട്ടലിൽ ഇടുക	Transphobic	eng_ml
1305	എല്ലാം ശരിയാകും. കുടുംബത്തോടൊപ്പം സുഖമായി ജീവിക്കട്ടെ	Non-anti-LGBT+ content	eng_ml
1306	നീ നിന്റെ അവകാശം ചോദിക്കുന്നെങ്കിൽ ഇതിലെന്താ കുഴപ്പം... സ്നേഹം ആർക്കും വരാം...	Non-anti-LGBT+ content	eng_ml
1307	ഈ വ്യക്തത എല്ലാവരേയും പിന്തുണയ്ക്കുകയാണെങ്കിൽ, മികച്ചതും വ്യക്തവുമായ ഉത്തരങ്ങൾ	Non-anti-LGBT+ content	eng_ml
1308	താങ്കളുടെ അഭിപ്രായം വളരെ വലുതാണ് സുഹൃത്തേ...എങ്കിലും അവരുടെ അവകാശങ്ങൾ അവരുടെ കൈകളിലാണെന്ന് മറക്കരുത്....	Non-anti-LGBT+ content	eng_ml
1309	യോഗേഷ് വാറൻ  അതെ.... അതെ... ശരി സഹോദരാ അതെല്ലാം മനുഷ്യരാശിയെ എങ്ങനെ നശിപ്പിക്കുന്നു... അങ്ങനെയായിരിക്കും ഈ ഒരു ദിവസം... കാത്തിരുന്ന് കാണുക..	Non-anti-LGBT+ content	eng_ml
1310	സുന്ദരികൾ പോലും ഇങ്ങനെയല്ല...	Non-anti-LGBT+ content	eng_ml
1311	ആണും പെണ്ണും കുടുംബങ്ങൾക്ക് വേണ്ടി ചെലവിടുന്നത് പോലെ സർക്കാർ ചെലവുകൾ വരുന്നില്ല	Non-anti-LGBT+ content	eng_ml
1312	അവരുടെ ഈ അവസ്ഥക്ക് നമ്മുടെ സമൂഹവും സർക്കാരുമാണ് ഉത്തരവാദികൾ.രക്ഷിതാക്കൾ കുട്ടികളെ ഇതുപോലെ ആദ്യം ഉപേക്ഷിക്കരുത്, അവരെ വീട്ടിൽ നിന്ന് പറഞ്ഞയക്കുന്നതാണ് ഇതിന് കാരണം.	Non-anti-LGBT+ content	eng_ml
1313	നിങ്ങൾ ഒരു മികച്ച പ്രഭാഷകനാണ്, സിംഹാസനം, നിങ്ങൾ ഒരു മികച്ച റെക്കോർഡിംഗ് നടത്തി മറ്റുള്ളവരെ മനസ്സിലാക്കി. നന്ദി സിംഹം തംബ്സ്_അപ്പ് തംബ്സ്_അപ്പ് തംബ്സ്_അപ്പ് മടക്കി_കൈകൾ മടക്കിയ_കൈകൾ മടക്കിയ_കൈകൾ	Non-anti-LGBT+ content	eng_ml
1314	റോമിൽ ജൂക്കൽ വെബ് സീരീസ്. ഇതും മികച്ചതായിരിക്കും. നിങ്ങൾ അത് കണ്ടോ????	Non-anti-LGBT+ content	eng_ml
1315	മരിക്കൂ ദേവൂഡിയ നായ, നമ്മുടെ നാട്ടിലേക്ക് പോകൂ	Homophobic	eng_ml
1316	നിങ്ങൾ ട്രാൻസ്ജെൻഡർ അല്ല! സ്ത്രീ! പോലീസുകാരും ജഡ്ജിമാരും പോലെയുള്ള ജോലികൾ നിങ്ങൾ അവർക്ക് നൽകിയാൽ, അവർ നിഷ്പക്ഷരും സത്യസന്ധരുമായിരിക്കും! എന്തിന്, ദൈവത്തിന്റെ ഭാഷയിൽ പറഞ്ഞാൽ, ഈ ആളുകൾ രാജകീയ നിമിഷത്തിൽ ആധിപത്യം സ്ഥാപിക്കാൻ ജനിച്ചവരാണ്. ശാസ്ത്രീയമായി പറഞ്ഞാൽ ഇവ ന്യൂട്രോണുകളാണ്. അവരെ ശരിയായി മനസ്സിലാക്കാതെയാണ് നമ്മുടെ മനുഷ്യസമൂഹം അവരെ അപമാനിക്കുന്നത്. ഒരു ആറ്റത്തിന് പ്രോട്ടോണും ഇലക്ട്രോണും ഇല്ലെങ്കിൽ, പരിക്രമണ പാതയിൽ ഒരു ഇലക്ട്രോൺ നഷ്ടപ്പെട്ടാൽ, ന്യൂട്രോൺ ആ നഷ്ടം ശരിയാക്കും, അതിനാൽ ലോകാവസാനത്തിൽ, പുരുഷന്റെയും സ്ത്രീയുടെയും നാശത്തിനുശേഷം, ഇവ മാത്രമേ ജീവിക്കൂ. കുറച്ച് യുഗങ്ങൾ! അതെ! ഇവ ന്യൂട്രോണുകളാണ്!	Non-anti-LGBT+ content	eng_ml
1317	ഒരു വലിയ മനുഷ്യൻ അങ്ങനെ സംസാരിക്കുന്നത് കാണാൻ എന്ത് വൃത്തികെട്ട കാഴ്ചയാണ്, എനിക്കെന്താ പറ്റിയത്, കറുത്ത പലഹാരം കാർ പാട്ട് കേൾക്കുന്നു, ഇത് എന്ത് നാടാണ്?	Non-anti-LGBT+ content	eng_ml
1318	വിജയ് കുമാർ അരവാണി നാടിന്റെ ശാപം എല്ലാവരും മോഷ്ടിക്കുന്നു എന്നതാണ്	Transphobic	eng_ml
1319	ശൂർണം ലക്ഷ്മി മാന്യമായി സംസാരിക്കുന്നു, പക്ഷേ ഇപ്പോൾ ആരും നിങ്ങളെ ബഹുമാനിക്കുന്നില്ല	Non-anti-LGBT+ content	eng_ml
1320	പണമുണ്ടാക്കാൻ റോസാപ്പൂവ് വിരിഞ്ഞു എന്ന് പറഞ്ഞ് പോസ്റ്റ് ഇറക്കി, എന്നിട്ട് അത് മാറ്റി. ഞാൻ പണത്തിനു വേണ്ടിയുള്ള ആളാണ്..	Non-anti-LGBT+ content	eng_ml
1321	മനുഷ്യനെ സംസ്കാരത്തിനുള്ളിൽ ബന്ധിക്കാൻ ശ്രമിക്കുന്ന ഈ സമൂഹം മറ്റുള്ളവരുടെ വികാരങ്ങളെ മാനിക്കുന്നില്ല.... ഞാൻ LGBT യെ പിന്തുണയ്ക്കുന്നു	Non-anti-LGBT+ content	eng_ml
